Timestamp,Year,Month,Day,Hour,PM2.5
11/7/2017 12:00,2017,11,7,12,64.51
11/7/2017 13:00,2017,11,7,13,69.95
11/7/2017 14:00,2017,11,7,14,92.79
11/7/2017 15:00,2017,11,7,15,109.66
11/7/2017 16:00,2017,11,7,16,116.5
11/7/2017 17:00,2017,11,7,17,124.21
11/7/2017 18:00,2017,11,7,18,123.45
11/7/2017 19:00,2017,11,7,19,120.31
11/7/2017 20:00,2017,11,7,20,108.75
11/7/2017 21:00,2017,11,7,21,97.8
11/7/2017 22:00,2017,11,7,22,88.1
11/7/2017 23:00,2017,11,7,23,81.64
11/8/2017 0:00,2017,11,8,0,83.82
11/8/2017 1:00,2017,11,8,1,85.14
11/8/2017 2:00,2017,11,8,2,90.41
11/8/2017 3:00,2017,11,8,3,105.33
11/8/2017 4:00,2017,11,8,4,108.1
11/8/2017 5:00,2017,11,8,5,114.92
11/8/2017 6:00,2017,11,8,6,112.2
11/8/2017 7:00,2017,11,8,7,114.65
11/8/2017 8:00,2017,11,8,8,107.47
11/8/2017 9:00,2017,11,8,9,92.59
11/8/2017 10:00,2017,11,8,10,90.64
11/8/2017 11:00,2017,11,8,11,84.32
11/8/2017 12:00,2017,11,8,12,88.05
11/8/2017 14:00,2017,11,8,14,116.13
11/8/2017 15:00,2017,11,8,15,127.02
11/8/2017 16:00,2017,11,8,16,133.68
11/8/2017 17:00,2017,11,8,17,139.93
11/8/2017 18:00,2017,11,8,18,144.17
11/8/2017 19:00,2017,11,8,19,148.35
11/8/2017 20:00,2017,11,8,20,127.28
11/8/2017 21:00,2017,11,8,21,121.23
11/8/2017 22:00,2017,11,8,22,110.23
11/8/2017 23:00,2017,11,8,23,106.87
11/9/2017 0:00,2017,11,9,0,94.48
11/9/2017 1:00,2017,11,9,1,106.37
11/9/2017 2:00,2017,11,9,2,107.4
11/9/2017 3:00,2017,11,9,3,113.35
11/9/2017 4:00,2017,11,9,4,117.2
11/9/2017 5:00,2017,11,9,5,128.94
11/9/2017 6:00,2017,11,9,6,120.38
11/9/2017 7:00,2017,11,9,7,116.13
11/9/2017 8:00,2017,11,9,8,109.22
11/9/2017 9:00,2017,11,9,9,98.69
11/9/2017 10:00,2017,11,9,10,89.56
11/9/2017 11:00,2017,11,9,11,89.11
11/9/2017 12:00,2017,11,9,12,88.72
11/9/2017 13:00,2017,11,9,13,96.58
11/9/2017 14:00,2017,11,9,14,114.2
11/9/2017 15:00,2017,11,9,15,129.62
11/9/2017 16:00,2017,11,9,16,138.29
11/9/2017 17:00,2017,11,9,17,139
11/9/2017 18:00,2017,11,9,18,140.76
11/9/2017 19:00,2017,11,9,19,138.09
11/9/2017 20:00,2017,11,9,20,128.08
11/9/2017 21:00,2017,11,9,21,119.64
11/9/2017 22:00,2017,11,9,22,118.42
11/9/2017 23:00,2017,11,9,23,115.75
11/10/2017 0:00,2017,11,10,0,117.98
11/10/2017 1:00,2017,11,10,1,119.77
11/10/2017 2:00,2017,11,10,2,122.38
11/10/2017 3:00,2017,11,10,3,124.24
11/10/2017 4:00,2017,11,10,4,127.7
11/10/2017 5:00,2017,11,10,5,131.93
11/10/2017 6:00,2017,11,10,6,126.64
11/10/2017 7:00,2017,11,10,7,115.03
11/10/2017 8:00,2017,11,10,8,106.94
11/10/2017 9:00,2017,11,10,9,96.86
11/10/2017 11:00,2017,11,10,11,78.79
11/10/2017 12:00,2017,11,10,12,85.95
11/10/2017 13:00,2017,11,10,13,90.63
11/10/2017 14:00,2017,11,10,14,110.53
11/10/2017 15:00,2017,11,10,15,123.91
11/10/2017 16:00,2017,11,10,16,135.9
11/10/2017 17:00,2017,11,10,17,147.86
11/10/2017 18:00,2017,11,10,18,151.05
11/10/2017 19:00,2017,11,10,19,142.58
11/10/2017 20:00,2017,11,10,20,136.63
11/10/2017 22:00,2017,11,10,22,120.57
11/10/2017 23:00,2017,11,10,23,113.02
11/11/2017 0:00,2017,11,11,0,112.61
11/11/2017 1:00,2017,11,11,1,109.12
11/11/2017 2:00,2017,11,11,2,112.92
11/11/2017 3:00,2017,11,11,3,114.77
11/11/2017 4:00,2017,11,11,4,124.24
11/11/2017 5:00,2017,11,11,5,123.66
11/11/2017 6:00,2017,11,11,6,119.88
11/11/2017 7:00,2017,11,11,7,114.5
11/11/2017 8:00,2017,11,11,8,102.28
11/11/2017 9:00,2017,11,11,9,83.24
11/11/2017 10:00,2017,11,11,10,74.97
11/11/2017 11:00,2017,11,11,11,73.27
11/11/2017 12:00,2017,11,11,12,73.56
11/11/2017 13:00,2017,11,11,13,82.42
11/11/2017 14:00,2017,11,11,14,100.85
11/11/2017 15:00,2017,11,11,15,114.28
11/11/2017 17:00,2017,11,11,17,133.14
11/11/2017 18:00,2017,11,11,18,135.18
11/11/2017 19:00,2017,11,11,19,133.42
11/11/2017 21:00,2017,11,11,21,125.85
11/11/2017 22:00,2017,11,11,22,121.81
11/11/2017 23:00,2017,11,11,23,117.91
11/12/2017 0:00,2017,11,12,0,116.25
11/12/2017 1:00,2017,11,12,1,117.44
11/12/2017 2:00,2017,11,12,2,118.35
11/12/2017 3:00,2017,11,12,3,120.25
11/12/2017 4:00,2017,11,12,4,128.12
11/12/2017 5:00,2017,11,12,5,123.12
11/12/2017 6:00,2017,11,12,6,117.91
11/12/2017 7:00,2017,11,12,7,108.05
11/12/2017 8:00,2017,11,12,8,97.32
11/12/2017 9:00,2017,11,12,9,88.29
11/12/2017 10:00,2017,11,12,10,82.04
11/12/2017 11:00,2017,11,12,11,78.16
11/12/2017 16:00,2017,11,12,16,138.12
11/12/2017 17:00,2017,11,12,17,145.43
11/12/2017 18:00,2017,11,12,18,146.52
11/12/2017 19:00,2017,11,12,19,153.42
11/12/2017 20:00,2017,11,12,20,139.98
11/12/2017 21:00,2017,11,12,21,133.45
11/12/2017 22:00,2017,11,12,22,129.97
11/12/2017 23:00,2017,11,12,23,124.89
11/13/2017 0:00,2017,11,13,0,117.34
11/13/2017 1:00,2017,11,13,1,113.29
11/13/2017 2:00,2017,11,13,2,115.26
11/13/2017 3:00,2017,11,13,3,116.68
11/13/2017 4:00,2017,11,13,4,125.93
11/13/2017 5:00,2017,11,13,5,131.38
11/13/2017 6:00,2017,11,13,6,122.79
11/13/2017 7:00,2017,11,13,7,110.68
11/13/2017 8:00,2017,11,13,8,106.21
11/13/2017 9:00,2017,11,13,9,95.84
11/13/2017 10:00,2017,11,13,10,90.59
11/13/2017 11:00,2017,11,13,11,91.14
11/13/2017 12:00,2017,11,13,12,94.93
11/13/2017 13:00,2017,11,13,13,97.58
11/13/2017 14:00,2017,11,13,14,114.48
11/13/2017 15:00,2017,11,13,15,137.95
11/13/2017 16:00,2017,11,13,16,140.47
11/13/2017 17:00,2017,11,13,17,145.67
11/13/2017 18:00,2017,11,13,18,141.88
11/13/2017 19:00,2017,11,13,19,152.48
11/13/2017 20:00,2017,11,13,20,125.24
11/13/2017 21:00,2017,11,13,21,117.44
11/13/2017 22:00,2017,11,13,22,103.19
11/13/2017 23:00,2017,11,13,23,103.08
11/14/2017 0:00,2017,11,14,0,104.71
11/14/2017 1:00,2017,11,14,1,104.28
11/14/2017 2:00,2017,11,14,2,104.34
11/14/2017 3:00,2017,11,14,3,115.3
11/14/2017 4:00,2017,11,14,4,119.53
11/14/2017 5:00,2017,11,14,5,107.97
11/14/2017 6:00,2017,11,14,6,101.77
11/14/2017 7:00,2017,11,14,7,89.68
11/14/2017 8:00,2017,11,14,8,91.11
11/14/2017 9:00,2017,11,14,9,79.69
11/14/2017 10:00,2017,11,14,10,66.83
11/14/2017 11:00,2017,11,14,11,69.19
11/14/2017 12:00,2017,11,14,12,66.23
11/14/2017 13:00,2017,11,14,13,66.66
11/14/2017 14:00,2017,11,14,14,67.57
11/14/2017 15:00,2017,11,14,15,76.74
11/15/2017 5:00,2017,11,15,5,99.13
11/15/2017 6:00,2017,11,15,6,94.03
11/15/2017 7:00,2017,11,15,7,79.33
11/15/2017 8:00,2017,11,15,8,66.51
11/15/2017 10:00,2017,11,15,10,56.48
11/15/2017 11:00,2017,11,15,11,56.37
11/15/2017 13:00,2017,11,15,13,61.74
11/15/2017 14:00,2017,11,15,14,68.89
11/15/2017 15:00,2017,11,15,15,86.45
11/15/2017 16:00,2017,11,15,16,93.67
11/15/2017 17:00,2017,11,15,17,95.02
11/15/2017 18:00,2017,11,15,18,92.58
11/15/2017 19:00,2017,11,15,19,89.79
11/15/2017 20:00,2017,11,15,20,79.6
11/15/2017 21:00,2017,11,15,21,76.07
11/15/2017 22:00,2017,11,15,22,71.59
11/15/2017 23:00,2017,11,15,23,71.17
11/16/2017 0:00,2017,11,16,0,68.78
11/16/2017 1:00,2017,11,16,1,66.56
11/16/2017 2:00,2017,11,16,2,73.34
11/16/2017 3:00,2017,11,16,3,77.89
11/16/2017 4:00,2017,11,16,4,86.32
11/16/2017 5:00,2017,11,16,5,84.02
11/16/2017 6:00,2017,11,16,6,82.15
11/16/2017 7:00,2017,11,16,7,76.76
11/16/2017 8:00,2017,11,16,8,69.41
11/16/2017 9:00,2017,11,16,9,63.41
11/16/2017 10:00,2017,11,16,10,57.08
11/16/2017 11:00,2017,11,16,11,55.95
11/16/2017 12:00,2017,11,16,12,57.94
11/16/2017 13:00,2017,11,16,13,67.75
11/16/2017 14:00,2017,11,16,14,75.18
11/16/2017 15:00,2017,11,16,15,82.98
11/16/2017 16:00,2017,11,16,16,87.49
11/16/2017 17:00,2017,11,16,17,86.87
11/16/2017 18:00,2017,11,16,18,86.09
11/16/2017 19:00,2017,11,16,19,81.39
11/16/2017 20:00,2017,11,16,20,72.96
11/16/2017 21:00,2017,11,16,21,72.18
11/16/2017 22:00,2017,11,16,22,72.93
11/16/2017 23:00,2017,11,16,23,75.28
11/17/2017 0:00,2017,11,17,0,75.25
11/17/2017 1:00,2017,11,17,1,74.96
11/17/2017 2:00,2017,11,17,2,78.34
11/17/2017 3:00,2017,11,17,3,86.79
11/17/2017 4:00,2017,11,17,4,82.48
11/17/2017 5:00,2017,11,17,5,77.47
11/17/2017 6:00,2017,11,17,6,73.54
11/17/2017 8:00,2017,11,17,8,58.28
11/17/2017 9:00,2017,11,17,9,58.7
11/17/2017 10:00,2017,11,17,10,58.45
11/17/2017 11:00,2017,11,17,11,56.19
11/17/2017 12:00,2017,11,17,12,54.87
11/17/2017 13:00,2017,11,17,13,60.8
11/17/2017 14:00,2017,11,17,14,73.62
11/17/2017 15:00,2017,11,17,15,77.91
11/17/2017 18:00,2017,11,17,18,84.26
11/17/2017 20:00,2017,11,17,20,73.79
11/17/2017 23:00,2017,11,17,23,69.13
11/18/2017 0:00,2017,11,18,0,69.28
11/18/2017 2:00,2017,11,18,2,70.48
11/18/2017 7:00,2017,11,18,7,71.19
11/18/2017 8:00,2017,11,18,8,64.14
11/18/2017 9:00,2017,11,18,9,62.77
11/18/2017 10:00,2017,11,18,10,58.78
11/18/2017 11:00,2017,11,18,11,59.61
11/18/2017 12:00,2017,11,18,12,62.42
11/18/2017 13:00,2017,11,18,13,69.86
11/18/2017 14:00,2017,11,18,14,84.33
11/18/2017 15:00,2017,11,18,15,93.72
11/18/2017 16:00,2017,11,18,16,92.66
11/18/2017 17:00,2017,11,18,17,89.34
11/18/2017 18:00,2017,11,18,18,87.21
11/18/2017 19:00,2017,11,18,19,87.01
11/18/2017 20:00,2017,11,18,20,81.57
11/18/2017 22:00,2017,11,18,22,77.17
11/18/2017 23:00,2017,11,18,23,77.33
11/19/2017 0:00,2017,11,19,0,75.65
11/19/2017 4:00,2017,11,19,4,80.47
11/19/2017 5:00,2017,11,19,5,81
11/19/2017 6:00,2017,11,19,6,75.51
11/19/2017 7:00,2017,11,19,7,70.66
11/19/2017 8:00,2017,11,19,8,70
11/19/2017 9:00,2017,11,19,9,67.65
11/19/2017 10:00,2017,11,19,10,61.8
11/19/2017 11:00,2017,11,19,11,61.05
11/19/2017 12:00,2017,11,19,12,59.71
11/19/2017 13:00,2017,11,19,13,68.26
11/19/2017 14:00,2017,11,19,14,80.31
11/19/2017 15:00,2017,11,19,15,90.17
11/19/2017 17:00,2017,11,19,17,92.86
11/19/2017 18:00,2017,11,19,18,95.28
11/19/2017 19:00,2017,11,19,19,95.08
11/20/2017 0:00,2017,11,20,0,74.28
11/20/2017 1:00,2017,11,20,1,74.49
11/20/2017 2:00,2017,11,20,2,74.45
11/20/2017 3:00,2017,11,20,3,77.17
11/20/2017 9:00,2017,11,20,9,61.98
11/20/2017 10:00,2017,11,20,10,59.46
11/20/2017 11:00,2017,11,20,11,48.98
11/20/2017 12:00,2017,11,20,12,52.8
11/20/2017 13:00,2017,11,20,13,59.47
11/20/2017 14:00,2017,11,20,14,75.4
11/20/2017 15:00,2017,11,20,15,79.12
11/20/2017 16:00,2017,11,20,16,84.48
11/20/2017 17:00,2017,11,20,17,89.4
11/20/2017 19:00,2017,11,20,19,84.11
11/20/2017 20:00,2017,11,20,20,74.85
11/20/2017 21:00,2017,11,20,21,72.16
11/20/2017 22:00,2017,11,20,22,70.85
11/20/2017 23:00,2017,11,20,23,66.89
11/21/2017 0:00,2017,11,21,0,67.13
11/21/2017 1:00,2017,11,21,1,68.33
11/21/2017 2:00,2017,11,21,2,71.4
11/21/2017 3:00,2017,11,21,3,79.1
11/21/2017 4:00,2017,11,21,4,87.53
11/21/2017 5:00,2017,11,21,5,87.13
11/21/2017 6:00,2017,11,21,6,79.39
11/21/2017 7:00,2017,11,21,7,72.88
11/21/2017 8:00,2017,11,21,8,66.58
11/21/2017 9:00,2017,11,21,9,60.83
11/21/2017 10:00,2017,11,21,10,57.46
11/21/2017 11:00,2017,11,21,11,69.81
11/21/2017 12:00,2017,11,21,12,56.29
11/21/2017 13:00,2017,11,21,13,61.4
11/21/2017 14:00,2017,11,21,14,74.03
11/21/2017 15:00,2017,11,21,15,86.95
11/21/2017 16:00,2017,11,21,16,99.18
11/21/2017 17:00,2017,11,21,17,101.88
11/21/2017 18:00,2017,11,21,18,102.7
11/21/2017 19:00,2017,11,21,19,101.96
11/21/2017 20:00,2017,11,21,20,97.12
11/21/2017 21:00,2017,11,21,21,95.19
11/21/2017 22:00,2017,11,21,22,86.94
11/21/2017 23:00,2017,11,21,23,89.56
11/22/2017 0:00,2017,11,22,0,87.22
11/22/2017 1:00,2017,11,22,1,84.72
11/22/2017 2:00,2017,11,22,2,88.94
11/22/2017 3:00,2017,11,22,3,93.53
11/22/2017 4:00,2017,11,22,4,96.76
11/22/2017 5:00,2017,11,22,5,103.56
11/22/2017 6:00,2017,11,22,6,102.32
11/22/2017 7:00,2017,11,22,7,98.49
11/22/2017 8:00,2017,11,22,8,98.76
11/22/2017 9:00,2017,11,22,9,93.33
11/23/2017 19:00,2017,11,23,19,115.58
11/24/2017 0:00,2017,11,24,0,84.5
11/24/2017 1:00,2017,11,24,1,84.56
11/24/2017 2:00,2017,11,24,2,89.57
11/24/2017 3:00,2017,11,24,3,98.19
11/24/2017 4:00,2017,11,24,4,112.82
11/24/2017 5:00,2017,11,24,5,113.95
11/24/2017 6:00,2017,11,24,6,101.69
11/24/2017 7:00,2017,11,24,7,92.45
11/24/2017 8:00,2017,11,24,8,81.87
11/24/2017 9:00,2017,11,24,9,71.62
11/24/2017 10:00,2017,11,24,10,64.91
11/24/2017 11:00,2017,11,24,11,63.88
11/24/2017 12:00,2017,11,24,12,63.77
11/24/2017 13:00,2017,11,24,13,72.17
11/24/2017 14:00,2017,11,24,14,90.92
11/24/2017 15:00,2017,11,24,15,119.42
11/24/2017 16:00,2017,11,24,16,133.28
11/24/2017 17:00,2017,11,24,17,134.03
11/24/2017 18:00,2017,11,24,18,132.41
11/24/2017 19:00,2017,11,24,19,129.72
11/24/2017 20:00,2017,11,24,20,118.05
11/24/2017 21:00,2017,11,24,21,110.89
11/24/2017 22:00,2017,11,24,22,102.82
11/24/2017 23:00,2017,11,24,23,98.74
11/25/2017 0:00,2017,11,25,0,97.6
11/25/2017 1:00,2017,11,25,1,99.56
11/25/2017 2:00,2017,11,25,2,100.37
11/25/2017 3:00,2017,11,25,3,105.26
11/25/2017 4:00,2017,11,25,4,119.04
11/25/2017 5:00,2017,11,25,5,118.55
11/25/2017 6:00,2017,11,25,6,108.83
11/25/2017 7:00,2017,11,25,7,91.68
11/25/2017 8:00,2017,11,25,8,80.21
11/25/2017 10:00,2017,11,25,10,68.03
11/25/2017 11:00,2017,11,25,11,62.68
11/25/2017 12:00,2017,11,25,12,68.73
11/25/2017 13:00,2017,11,25,13,79.77
11/25/2017 14:00,2017,11,25,14,97
11/25/2017 16:00,2017,11,25,16,134.48
11/25/2017 17:00,2017,11,25,17,144.05
11/25/2017 18:00,2017,11,25,18,140.55
11/25/2017 19:00,2017,11,25,19,139.48
11/25/2017 20:00,2017,11,25,20,131.29
11/25/2017 21:00,2017,11,25,21,123.36
11/25/2017 22:00,2017,11,25,22,114.81
11/25/2017 23:00,2017,11,25,23,105.59
11/26/2017 0:00,2017,11,26,0,105.94
11/26/2017 1:00,2017,11,26,1,104.58
11/26/2017 2:00,2017,11,26,2,104.5
11/26/2017 3:00,2017,11,26,3,115.64
11/26/2017 4:00,2017,11,26,4,121.76
11/26/2017 5:00,2017,11,26,5,113.76
11/26/2017 6:00,2017,11,26,6,110.03
11/26/2017 7:00,2017,11,26,7,103.83
11/26/2017 8:00,2017,11,26,8,94.15
11/26/2017 9:00,2017,11,26,9,75.74
11/26/2017 10:00,2017,11,26,10,69.5
11/26/2017 11:00,2017,11,26,11,65.52
11/26/2017 12:00,2017,11,26,12,64.68
11/26/2017 13:00,2017,11,26,13,73.34
11/26/2017 14:00,2017,11,26,14,95.86
11/26/2017 15:00,2017,11,26,15,117.45
11/26/2017 16:00,2017,11,26,16,136.75
11/26/2017 17:00,2017,11,26,17,140.07
11/26/2017 18:00,2017,11,26,18,133.02
11/26/2017 19:00,2017,11,26,19,128.78
11/26/2017 20:00,2017,11,26,20,116.71
11/26/2017 21:00,2017,11,26,21,107.26
11/26/2017 22:00,2017,11,26,22,98.95
11/26/2017 23:00,2017,11,26,23,95.13
11/27/2017 0:00,2017,11,27,0,90.67
11/27/2017 1:00,2017,11,27,1,91.57
11/27/2017 2:00,2017,11,27,2,88.61
11/27/2017 3:00,2017,11,27,3,105.2
11/27/2017 4:00,2017,11,27,4,116.2
11/27/2017 5:00,2017,11,27,5,117.48
11/27/2017 6:00,2017,11,27,6,107.66
11/27/2017 7:00,2017,11,27,7,97.27
11/27/2017 8:00,2017,11,27,8,83.87
11/27/2017 9:00,2017,11,27,9,74.58
11/27/2017 10:00,2017,11,27,10,70.1
11/27/2017 11:00,2017,11,27,11,64.7
11/27/2017 12:00,2017,11,27,12,66.98
11/27/2017 13:00,2017,11,27,13,75.92
11/27/2017 14:00,2017,11,27,14,100.99
11/27/2017 15:00,2017,11,27,15,117.66
11/27/2017 17:00,2017,11,27,17,140.07
11/27/2017 19:00,2017,11,27,19,136.31
11/27/2017 20:00,2017,11,27,20,129.04
11/27/2017 21:00,2017,11,27,21,121.18
11/27/2017 22:00,2017,11,27,22,107.53
11/27/2017 23:00,2017,11,27,23,109.74
11/28/2017 0:00,2017,11,28,0,101.91
11/28/2017 1:00,2017,11,28,1,95.83
11/28/2017 2:00,2017,11,28,2,95.08
11/28/2017 3:00,2017,11,28,3,111.67
11/28/2017 4:00,2017,11,28,4,123.48
11/28/2017 5:00,2017,11,28,5,121.63
11/28/2017 6:00,2017,11,28,6,113.15
11/28/2017 8:00,2017,11,28,8,81.06
11/28/2017 9:00,2017,11,28,9,67.36
11/28/2017 10:00,2017,11,28,10,60.98
11/28/2017 11:00,2017,11,28,11,58.84
11/28/2017 12:00,2017,11,28,12,55.86
11/28/2017 13:00,2017,11,28,13,64.66
11/28/2017 14:00,2017,11,28,14,84.93
11/28/2017 15:00,2017,11,28,15,106.09
11/28/2017 16:00,2017,11,28,16,131.55
11/28/2017 17:00,2017,11,28,17,140.43
11/28/2017 18:00,2017,11,28,18,145.98
11/28/2017 19:00,2017,11,28,19,142.5
11/28/2017 20:00,2017,11,28,20,132.23
11/28/2017 21:00,2017,11,28,21,130.03
11/28/2017 23:00,2017,11,28,23,105.54
11/29/2017 0:00,2017,11,29,0,100.54
11/29/2017 1:00,2017,11,29,1,99.35
11/29/2017 2:00,2017,11,29,2,100.24
11/29/2017 3:00,2017,11,29,3,112.24
11/29/2017 4:00,2017,11,29,4,120.5
11/29/2017 5:00,2017,11,29,5,115.52
11/29/2017 6:00,2017,11,29,6,111.64
11/29/2017 7:00,2017,11,29,7,86.75
11/29/2017 8:00,2017,11,29,8,82.24
11/29/2017 9:00,2017,11,29,9,72.02
11/29/2017 10:00,2017,11,29,10,66.72
11/29/2017 11:00,2017,11,29,11,60.44
11/29/2017 12:00,2017,11,29,12,62.82
11/29/2017 13:00,2017,11,29,13,75.25
11/29/2017 14:00,2017,11,29,14,93.54
11/29/2017 15:00,2017,11,29,15,110.29
11/29/2017 16:00,2017,11,29,16,126.93
11/29/2017 17:00,2017,11,29,17,135.73
11/29/2017 18:00,2017,11,29,18,141.01
11/29/2017 19:00,2017,11,29,19,145.62
11/29/2017 20:00,2017,11,29,20,129.94
11/29/2017 21:00,2017,11,29,21,108.56
11/29/2017 22:00,2017,11,29,22,100.34
11/29/2017 23:00,2017,11,29,23,100.48
11/30/2017 0:00,2017,11,30,0,96.4
11/30/2017 1:00,2017,11,30,1,98.14
11/30/2017 2:00,2017,11,30,2,103.11
11/30/2017 3:00,2017,11,30,3,110.62
11/30/2017 4:00,2017,11,30,4,120.43
11/30/2017 5:00,2017,11,30,5,121.27
11/30/2017 6:00,2017,11,30,6,111.21
11/30/2017 7:00,2017,11,30,7,100.26
11/30/2017 8:00,2017,11,30,8,90.32
11/30/2017 9:00,2017,11,30,9,78.51
11/30/2017 11:00,2017,11,30,11,58.71
11/30/2017 12:00,2017,11,30,12,63.62
11/30/2017 13:00,2017,11,30,13,72.3
11/30/2017 14:00,2017,11,30,14,94.81
11/30/2017 15:00,2017,11,30,15,110.16
11/30/2017 16:00,2017,11,30,16,116.57
11/30/2017 17:00,2017,11,30,17,143.21
11/30/2017 19:00,2017,11,30,19,133.7
11/30/2017 20:00,2017,11,30,20,118.77
11/30/2017 21:00,2017,11,30,21,114.57
11/30/2017 22:00,2017,11,30,22,104.28
11/30/2017 23:00,2017,11,30,23,102.18
12/1/2017 0:00,2017,12,1,0,104.29
12/1/2017 1:00,2017,12,1,1,103.38
12/1/2017 2:00,2017,12,1,2,102.81
12/1/2017 3:00,2017,12,1,3,115.19
12/1/2017 4:00,2017,12,1,4,117.31
12/1/2017 5:00,2017,12,1,5,116.79
12/1/2017 6:00,2017,12,1,6,112.67
12/1/2017 7:00,2017,12,1,7,91.38
12/1/2017 8:00,2017,12,1,8,82.44
12/1/2017 9:00,2017,12,1,9,70.58
12/1/2017 10:00,2017,12,1,10,61.98
12/1/2017 11:00,2017,12,1,11,58.04
12/1/2017 12:00,2017,12,1,12,59.92
12/1/2017 13:00,2017,12,1,13,64.11
12/1/2017 14:00,2017,12,1,14,88.08
12/1/2017 15:00,2017,12,1,15,106.65
12/1/2017 16:00,2017,12,1,16,114.49
12/1/2017 17:00,2017,12,1,17,123.88
12/1/2017 18:00,2017,12,1,18,121.35
12/1/2017 19:00,2017,12,1,19,122.11
12/1/2017 20:00,2017,12,1,20,107.9
12/1/2017 21:00,2017,12,1,21,101.59
12/1/2017 22:00,2017,12,1,22,95.32
12/1/2017 23:00,2017,12,1,23,88.33
12/2/2017 0:00,2017,12,2,0,91.32
12/2/2017 1:00,2017,12,2,1,87.85
12/2/2017 2:00,2017,12,2,2,91.77
12/2/2017 3:00,2017,12,2,3,105.4
12/2/2017 4:00,2017,12,2,4,109.71
12/2/2017 5:00,2017,12,2,5,106.19
12/2/2017 6:00,2017,12,2,6,101.12
12/2/2017 7:00,2017,12,2,7,98.26
12/2/2017 8:00,2017,12,2,8,80.05
12/2/2017 9:00,2017,12,2,9,67.05
12/2/2017 10:00,2017,12,2,10,62.03
12/2/2017 11:00,2017,12,2,11,58.42
12/2/2017 12:00,2017,12,2,12,59.35
12/2/2017 13:00,2017,12,2,13,69.28
12/2/2017 14:00,2017,12,2,14,89.11
12/2/2017 15:00,2017,12,2,15,112.91
12/2/2017 16:00,2017,12,2,16,131.22
12/2/2017 17:00,2017,12,2,17,138.98
12/2/2017 18:00,2017,12,2,18,143.39
12/2/2017 19:00,2017,12,2,19,141.04
12/2/2017 20:00,2017,12,2,20,127.57
12/2/2017 21:00,2017,12,2,21,114.82
12/2/2017 22:00,2017,12,2,22,104.62
12/2/2017 23:00,2017,12,2,23,99.4
12/3/2017 0:00,2017,12,3,0,95.87
12/3/2017 1:00,2017,12,3,1,95.97
12/3/2017 2:00,2017,12,3,2,106.3
12/3/2017 3:00,2017,12,3,3,115.84
12/3/2017 4:00,2017,12,3,4,114.03
12/3/2017 5:00,2017,12,3,5,111.16
12/3/2017 6:00,2017,12,3,6,100.23
12/3/2017 8:00,2017,12,3,8,84.37
12/3/2017 9:00,2017,12,3,9,73.1
12/3/2017 10:00,2017,12,3,10,63.23
12/3/2017 11:00,2017,12,3,11,63.06
12/3/2017 12:00,2017,12,3,12,64.57
12/3/2017 13:00,2017,12,3,13,70.94
12/3/2017 14:00,2017,12,3,14,92.6
12/3/2017 15:00,2017,12,3,15,104.2
12/3/2017 16:00,2017,12,3,16,127.17
12/3/2017 17:00,2017,12,3,17,128.53
12/3/2017 18:00,2017,12,3,18,131.24
12/3/2017 19:00,2017,12,3,19,130.76
12/3/2017 20:00,2017,12,3,20,125.12
12/3/2017 21:00,2017,12,3,21,117.11
12/3/2017 22:00,2017,12,3,22,108.24
12/3/2017 23:00,2017,12,3,23,100.56
12/4/2017 0:00,2017,12,4,0,97.18
12/4/2017 1:00,2017,12,4,1,97.16
12/4/2017 2:00,2017,12,4,2,101.78
12/4/2017 3:00,2017,12,4,3,107
12/4/2017 4:00,2017,12,4,4,116.9
12/4/2017 5:00,2017,12,4,5,123.48
12/4/2017 6:00,2017,12,4,6,117.82
12/4/2017 7:00,2017,12,4,7,100.53
12/4/2017 8:00,2017,12,4,8,94.32
12/4/2017 9:00,2017,12,4,9,81.81
12/4/2017 10:00,2017,12,4,10,78.75
12/4/2017 11:00,2017,12,4,11,72.21
12/4/2017 12:00,2017,12,4,12,79.8
12/4/2017 13:00,2017,12,4,13,88.54
12/4/2017 14:00,2017,12,4,14,109.16
12/4/2017 15:00,2017,12,4,15,118.86
12/4/2017 16:00,2017,12,4,16,122.2
12/4/2017 17:00,2017,12,4,17,123.21
12/4/2017 18:00,2017,12,4,18,123.14
12/4/2017 22:00,2017,12,4,22,102.1
12/4/2017 23:00,2017,12,4,23,97.44
12/5/2017 0:00,2017,12,5,0,96.38
12/5/2017 1:00,2017,12,5,1,97.47
12/5/2017 2:00,2017,12,5,2,101.49
12/5/2017 3:00,2017,12,5,3,115.73
12/5/2017 4:00,2017,12,5,4,121.72
12/5/2017 5:00,2017,12,5,5,128.16
12/5/2017 7:00,2017,12,5,7,94.07
12/5/2017 11:00,2017,12,5,11,80.47
12/5/2017 12:00,2017,12,5,12,77.6
12/5/2017 14:00,2017,12,5,14,95.43
12/5/2017 15:00,2017,12,5,15,111.05
12/5/2017 16:00,2017,12,5,16,106.18
12/5/2017 17:00,2017,12,5,17,105.29
12/5/2017 18:00,2017,12,5,18,102.87
12/5/2017 20:00,2017,12,5,20,78.98
12/5/2017 22:00,2017,12,5,22,86.03
12/5/2017 23:00,2017,12,5,23,82.86
12/6/2017 0:00,2017,12,6,0,82.2
12/6/2017 1:00,2017,12,6,1,77.62
12/6/2017 2:00,2017,12,6,2,84.47
12/6/2017 3:00,2017,12,6,3,95.77
12/6/2017 4:00,2017,12,6,4,101.66
12/6/2017 5:00,2017,12,6,5,103.02
12/6/2017 6:00,2017,12,6,6,92.64
12/6/2017 7:00,2017,12,6,7,87.71
12/6/2017 8:00,2017,12,6,8,75.08
12/6/2017 9:00,2017,12,6,9,67.98
12/6/2017 10:00,2017,12,6,10,60.28
12/6/2017 11:00,2017,12,6,11,60.2
12/6/2017 12:00,2017,12,6,12,67.32
12/6/2017 13:00,2017,12,6,13,80.9
12/6/2017 14:00,2017,12,6,14,90.02
12/6/2017 16:00,2017,12,6,16,101.76
12/6/2017 17:00,2017,12,6,17,99.31
12/6/2017 18:00,2017,12,6,18,101.34
12/6/2017 19:00,2017,12,6,19,96.94
12/6/2017 20:00,2017,12,6,20,80.93
12/6/2017 21:00,2017,12,6,21,77.52
12/6/2017 22:00,2017,12,6,22,77.77
12/6/2017 23:00,2017,12,6,23,73.01
12/7/2017 0:00,2017,12,7,0,73.75
12/7/2017 1:00,2017,12,7,1,79.75
12/7/2017 2:00,2017,12,7,2,86.78
12/7/2017 3:00,2017,12,7,3,98.41
12/7/2017 4:00,2017,12,7,4,107
12/7/2017 5:00,2017,12,7,5,100.38
12/7/2017 6:00,2017,12,7,6,84.23
12/7/2017 7:00,2017,12,7,7,76.89
12/7/2017 8:00,2017,12,7,8,65.25
12/7/2017 9:00,2017,12,7,9,60.9
12/7/2017 13:00,2017,12,7,13,76.78
12/7/2017 14:00,2017,12,7,14,94.44
12/7/2017 15:00,2017,12,7,15,107.13
12/7/2017 16:00,2017,12,7,16,110.42
12/7/2017 17:00,2017,12,7,17,113.72
12/7/2017 19:00,2017,12,7,19,102.03
12/7/2017 20:00,2017,12,7,20,88.92
12/7/2017 21:00,2017,12,7,21,86.85
12/7/2017 22:00,2017,12,7,22,79.78
12/7/2017 23:00,2017,12,7,23,73.45
12/8/2017 1:00,2017,12,8,1,78.52
12/8/2017 2:00,2017,12,8,2,86.26
12/8/2017 4:00,2017,12,8,4,104.19
12/8/2017 5:00,2017,12,8,5,97.34
12/8/2017 6:00,2017,12,8,6,94.04
12/8/2017 7:00,2017,12,8,7,77.54
12/8/2017 8:00,2017,12,8,8,69.95
12/8/2017 9:00,2017,12,8,9,68.85
12/8/2017 10:00,2017,12,8,10,64
12/8/2017 11:00,2017,12,8,11,61.54
12/8/2017 12:00,2017,12,8,12,59.48
12/8/2017 13:00,2017,12,8,13,74.46
12/8/2017 14:00,2017,12,8,14,97.88
12/8/2017 15:00,2017,12,8,15,107.64
12/8/2017 16:00,2017,12,8,16,116.9
12/8/2017 17:00,2017,12,8,17,115.43
12/8/2017 18:00,2017,12,8,18,116.09
12/8/2017 19:00,2017,12,8,19,110.55
12/8/2017 20:00,2017,12,8,20,96.96
12/8/2017 21:00,2017,12,8,21,88.44
12/8/2017 22:00,2017,12,8,22,84.88
12/8/2017 23:00,2017,12,8,23,80.57
12/9/2017 0:00,2017,12,9,0,79.03
12/9/2017 1:00,2017,12,9,1,79.36
12/9/2017 2:00,2017,12,9,2,85.31
12/9/2017 3:00,2017,12,9,3,92.53
12/9/2017 4:00,2017,12,9,4,95.4
12/9/2017 5:00,2017,12,9,5,102.36
12/9/2017 6:00,2017,12,9,6,93.19
12/9/2017 7:00,2017,12,9,7,82.72
12/9/2017 8:00,2017,12,9,8,75.71
12/9/2017 9:00,2017,12,9,9,67.56
12/9/2017 10:00,2017,12,9,10,57.37
12/9/2017 11:00,2017,12,9,11,52.87
12/9/2017 12:00,2017,12,9,12,55.66
12/9/2017 13:00,2017,12,9,13,66.01
12/9/2017 14:00,2017,12,9,14,85.8
12/9/2017 15:00,2017,12,9,15,100.15
12/9/2017 16:00,2017,12,9,16,112.45
12/9/2017 17:00,2017,12,9,17,115.63
12/9/2017 18:00,2017,12,9,18,113.23
12/9/2017 19:00,2017,12,9,19,110.76
12/9/2017 20:00,2017,12,9,20,91.33
12/9/2017 21:00,2017,12,9,21,86.75
12/9/2017 22:00,2017,12,9,22,86.35
12/9/2017 23:00,2017,12,9,23,81.45
12/10/2017 0:00,2017,12,10,0,75.9
12/10/2017 1:00,2017,12,10,1,71.68
12/10/2017 2:00,2017,12,10,2,77.49
12/10/2017 3:00,2017,12,10,3,87.55
12/10/2017 4:00,2017,12,10,4,89.51
12/10/2017 5:00,2017,12,10,5,93.6
12/10/2017 6:00,2017,12,10,6,84.31
12/10/2017 11:00,2017,12,10,11,42.85
12/10/2017 13:00,2017,12,10,13,55.7
12/10/2017 14:00,2017,12,10,14,75.01
12/10/2017 15:00,2017,12,10,15,94.87
12/10/2017 16:00,2017,12,10,16,101.36
12/10/2017 17:00,2017,12,10,17,108.52
12/10/2017 18:00,2017,12,10,18,103.49
12/10/2017 19:00,2017,12,10,19,106.23
12/10/2017 20:00,2017,12,10,20,99.78
12/10/2017 21:00,2017,12,10,21,90.57
12/10/2017 22:00,2017,12,10,22,87.85
12/10/2017 23:00,2017,12,10,23,83.62
12/11/2017 0:00,2017,12,11,0,80.77
12/11/2017 1:00,2017,12,11,1,78.74
12/11/2017 2:00,2017,12,11,2,85.36
12/11/2017 3:00,2017,12,11,3,94.1
12/11/2017 4:00,2017,12,11,4,104.11
12/11/2017 5:00,2017,12,11,5,112.58
12/11/2017 6:00,2017,12,11,6,102.46
12/11/2017 7:00,2017,12,11,7,91.52
12/11/2017 8:00,2017,12,11,8,70.04
12/11/2017 9:00,2017,12,11,9,59.97
12/11/2017 10:00,2017,12,11,10,55.76
12/11/2017 11:00,2017,12,11,11,52.55
12/11/2017 12:00,2017,12,11,12,57.02
12/11/2017 13:00,2017,12,11,13,67.84
12/11/2017 14:00,2017,12,11,14,87.58
12/11/2017 15:00,2017,12,11,15,91.71
12/11/2017 16:00,2017,12,11,16,92.19
12/11/2017 17:00,2017,12,11,17,89.75
12/11/2017 18:00,2017,12,11,18,92
12/11/2017 19:00,2017,12,11,19,83.05
12/11/2017 20:00,2017,12,11,20,86.27
12/11/2017 21:00,2017,12,11,21,86.86
12/11/2017 22:00,2017,12,11,22,73.72
12/11/2017 23:00,2017,12,11,23,69.77
12/12/2017 0:00,2017,12,12,0,76.2
12/12/2017 1:00,2017,12,12,1,74.02
12/12/2017 2:00,2017,12,12,2,81.21
12/12/2017 3:00,2017,12,12,3,88.81
12/12/2017 4:00,2017,12,12,4,91.18
12/12/2017 5:00,2017,12,12,5,95.35
12/12/2017 6:00,2017,12,12,6,85.67
12/12/2017 7:00,2017,12,12,7,83.05
12/12/2017 8:00,2017,12,12,8,70.73
12/12/2017 9:00,2017,12,12,9,62.74
12/12/2017 10:00,2017,12,12,10,59.89
12/12/2017 11:00,2017,12,12,11,56.13
12/12/2017 12:00,2017,12,12,12,56.71
12/12/2017 13:00,2017,12,12,13,66.21
12/12/2017 14:00,2017,12,12,14,83.13
12/12/2017 15:00,2017,12,12,15,97.68
12/12/2017 16:00,2017,12,12,16,100.76
12/12/2017 17:00,2017,12,12,17,100.96
12/12/2017 18:00,2017,12,12,18,98.55
12/12/2017 19:00,2017,12,12,19,96.72
12/12/2017 20:00,2017,12,12,20,88.78
12/12/2017 21:00,2017,12,12,21,83.81
12/12/2017 22:00,2017,12,12,22,81.11
12/13/2017 0:00,2017,12,13,0,74.72
12/13/2017 1:00,2017,12,13,1,75.1
12/13/2017 2:00,2017,12,13,2,79.35
12/13/2017 3:00,2017,12,13,3,85.69
12/13/2017 4:00,2017,12,13,4,93.85
12/13/2017 5:00,2017,12,13,5,93.61
12/13/2017 6:00,2017,12,13,6,88.26
12/13/2017 7:00,2017,12,13,7,81
12/13/2017 8:00,2017,12,13,8,69.82
12/13/2017 9:00,2017,12,13,9,56.59
12/13/2017 10:00,2017,12,13,10,53.35
12/13/2017 12:00,2017,12,13,12,54.52
12/13/2017 13:00,2017,12,13,13,63.64
12/13/2017 14:00,2017,12,13,14,70.43
12/13/2017 15:00,2017,12,13,15,81.62
12/13/2017 16:00,2017,12,13,16,89.12
12/13/2017 17:00,2017,12,13,17,87.47
12/13/2017 18:00,2017,12,13,18,86.35
12/13/2017 19:00,2017,12,13,19,85.65
12/13/2017 20:00,2017,12,13,20,75.99
12/13/2017 21:00,2017,12,13,21,74.66
12/13/2017 22:00,2017,12,13,22,72.55
12/13/2017 23:00,2017,12,13,23,69.27
12/14/2017 0:00,2017,12,14,0,66.62
12/14/2017 1:00,2017,12,14,1,66.33
12/14/2017 2:00,2017,12,14,2,71.56
12/14/2017 3:00,2017,12,14,3,81
12/14/2017 4:00,2017,12,14,4,85.53
12/14/2017 5:00,2017,12,14,5,85.83
12/14/2017 6:00,2017,12,14,6,81.34
12/14/2017 7:00,2017,12,14,7,68.36
12/14/2017 8:00,2017,12,14,8,62.29
12/14/2017 9:00,2017,12,14,9,56.68
12/14/2017 10:00,2017,12,14,10,52.77
12/14/2017 11:00,2017,12,14,11,51.73
12/14/2017 12:00,2017,12,14,12,51.31
12/14/2017 13:00,2017,12,14,13,60.35
12/14/2017 14:00,2017,12,14,14,72.24
12/14/2017 15:00,2017,12,14,15,82.74
12/14/2017 16:00,2017,12,14,16,90.72
12/14/2017 17:00,2017,12,14,17,88.82
12/14/2017 18:00,2017,12,14,18,85.75
12/14/2017 19:00,2017,12,14,19,85.65
12/14/2017 20:00,2017,12,14,20,79.69
12/14/2017 21:00,2017,12,14,21,75.46
12/14/2017 22:00,2017,12,14,22,71.52
12/14/2017 23:00,2017,12,14,23,68.65
12/15/2017 0:00,2017,12,15,0,70.44
12/15/2017 1:00,2017,12,15,1,67.33
12/15/2017 2:00,2017,12,15,2,71.29
12/15/2017 3:00,2017,12,15,3,81.59
12/15/2017 4:00,2017,12,15,4,84.54
12/15/2017 5:00,2017,12,15,5,85.32
12/15/2017 6:00,2017,12,15,6,81.66
12/15/2017 7:00,2017,12,15,7,78.84
12/15/2017 8:00,2017,12,15,8,70.93
12/15/2017 9:00,2017,12,15,9,65.56
12/15/2017 10:00,2017,12,15,10,64.48
12/16/2017 14:00,2017,12,16,14,74.65
12/16/2017 15:00,2017,12,16,15,83.44
12/16/2017 16:00,2017,12,16,16,90
12/16/2017 17:00,2017,12,16,17,93.79
12/16/2017 18:00,2017,12,16,18,88.77
12/16/2017 20:00,2017,12,16,20,74.45
12/16/2017 22:00,2017,12,16,22,73.68
12/16/2017 23:00,2017,12,16,23,71.53
12/17/2017 0:00,2017,12,17,0,70.05
12/17/2017 1:00,2017,12,17,1,66.9
12/17/2017 2:00,2017,12,17,2,70.82
12/17/2017 3:00,2017,12,17,3,80.14
12/17/2017 4:00,2017,12,17,4,88.78
12/17/2017 5:00,2017,12,17,5,92.01
12/17/2017 6:00,2017,12,17,6,82.38
12/17/2017 7:00,2017,12,17,7,74.44
12/17/2017 8:00,2017,12,17,8,67.35
12/17/2017 9:00,2017,12,17,9,59.63
12/17/2017 10:00,2017,12,17,10,54.64
12/17/2017 11:00,2017,12,17,11,53.92
12/17/2017 12:00,2017,12,17,12,55.65
12/17/2017 13:00,2017,12,17,13,62.55
12/17/2017 14:00,2017,12,17,14,77.52
12/17/2017 16:00,2017,12,17,16,104.19
12/17/2017 17:00,2017,12,17,17,98.91
12/17/2017 21:00,2017,12,17,21,69.36
12/17/2017 22:00,2017,12,17,22,66.05
12/18/2017 1:00,2017,12,18,1,60.29
12/18/2017 2:00,2017,12,18,2,67.09
12/18/2017 3:00,2017,12,18,3,78.94
12/18/2017 4:00,2017,12,18,4,85.99
12/18/2017 7:00,2017,12,18,7,73.32
12/18/2017 8:00,2017,12,18,8,71.02
12/18/2017 9:00,2017,12,18,9,65.84
12/18/2017 10:00,2017,12,18,10,59.14
12/18/2017 11:00,2017,12,18,11,56.88
12/18/2017 12:00,2017,12,18,12,62.37
12/18/2017 13:00,2017,12,18,13,67.89
12/18/2017 14:00,2017,12,18,14,92.15
12/18/2017 15:00,2017,12,18,15,102.79
12/18/2017 16:00,2017,12,18,16,111.06
12/18/2017 17:00,2017,12,18,17,109.24
12/18/2017 18:00,2017,12,18,18,98.37
12/18/2017 19:00,2017,12,18,19,98.08
12/18/2017 20:00,2017,12,18,20,89.79
12/18/2017 21:00,2017,12,18,21,79.95
12/18/2017 23:00,2017,12,18,23,77.68
12/19/2017 0:00,2017,12,19,0,76.76
12/19/2017 1:00,2017,12,19,1,77.53
12/19/2017 2:00,2017,12,19,2,80.84
12/19/2017 3:00,2017,12,19,3,91.15
12/19/2017 4:00,2017,12,19,4,102.63
12/19/2017 5:00,2017,12,19,5,106.24
12/19/2017 6:00,2017,12,19,6,99.4
12/19/2017 7:00,2017,12,19,7,94.59
12/19/2017 8:00,2017,12,19,8,89.6
12/19/2017 9:00,2017,12,19,9,81.1
12/19/2017 10:00,2017,12,19,10,69.23
12/19/2017 11:00,2017,12,19,11,66.3
12/19/2017 12:00,2017,12,19,12,70.74
12/19/2017 13:00,2017,12,19,13,78.2
12/19/2017 14:00,2017,12,19,14,95.64
12/19/2017 15:00,2017,12,19,15,115.92
12/19/2017 16:00,2017,12,19,16,109.66
12/19/2017 17:00,2017,12,19,17,140.15
12/19/2017 18:00,2017,12,19,18,137.86
12/19/2017 19:00,2017,12,19,19,135.55
12/19/2017 20:00,2017,12,19,20,125.66
12/19/2017 21:00,2017,12,19,21,115.4
12/19/2017 22:00,2017,12,19,22,104.61
12/19/2017 23:00,2017,12,19,23,97.98
12/20/2017 0:00,2017,12,20,0,95.73
12/20/2017 1:00,2017,12,20,1,93.64
12/20/2017 2:00,2017,12,20,2,98.8
12/20/2017 3:00,2017,12,20,3,107.74
12/20/2017 4:00,2017,12,20,4,116.61
12/20/2017 5:00,2017,12,20,5,133.66
12/20/2017 6:00,2017,12,20,6,125.68
12/20/2017 7:00,2017,12,20,7,105.51
12/20/2017 8:00,2017,12,20,8,99.66
12/20/2017 9:00,2017,12,20,9,85.95
12/20/2017 10:00,2017,12,20,10,79.54
12/20/2017 12:00,2017,12,20,12,76.92
12/20/2017 13:00,2017,12,20,13,99.43
12/20/2017 14:00,2017,12,20,14,120.05
12/20/2017 15:00,2017,12,20,15,139.96
12/20/2017 16:00,2017,12,20,16,152.51
12/20/2017 17:00,2017,12,20,17,149.62
12/20/2017 18:00,2017,12,20,18,150.59
12/20/2017 19:00,2017,12,20,19,144.37
12/20/2017 20:00,2017,12,20,20,143.01
12/20/2017 21:00,2017,12,20,21,123.2
12/20/2017 22:00,2017,12,20,22,112.56
12/20/2017 23:00,2017,12,20,23,116.59
12/21/2017 0:00,2017,12,21,0,115.11
12/21/2017 1:00,2017,12,21,1,111.52
12/21/2017 2:00,2017,12,21,2,107.84
12/21/2017 3:00,2017,12,21,3,123.3
12/21/2017 4:00,2017,12,21,4,130.97
12/21/2017 5:00,2017,12,21,5,135.84
12/21/2017 6:00,2017,12,21,6,114.34
12/21/2017 7:00,2017,12,21,7,111.32
12/21/2017 8:00,2017,12,21,8,98.52
12/21/2017 9:00,2017,12,21,9,92.27
12/21/2017 10:00,2017,12,21,10,80.48
12/21/2017 11:00,2017,12,21,11,75.75
12/21/2017 12:00,2017,12,21,12,73.72
12/21/2017 13:00,2017,12,21,13,77.5
12/21/2017 14:00,2017,12,21,14,101.27
12/21/2017 15:00,2017,12,21,15,120.94
12/21/2017 16:00,2017,12,21,16,130.48
12/21/2017 17:00,2017,12,21,17,132.91
12/21/2017 18:00,2017,12,21,18,119.17
12/21/2017 19:00,2017,12,21,19,115.17
12/21/2017 20:00,2017,12,21,20,99.48
12/21/2017 21:00,2017,12,21,21,91.5
12/21/2017 22:00,2017,12,21,22,96.2
12/21/2017 23:00,2017,12,21,23,89.8
12/22/2017 0:00,2017,12,22,0,86.72
12/22/2017 1:00,2017,12,22,1,80.77
12/22/2017 2:00,2017,12,22,2,87.91
12/22/2017 3:00,2017,12,22,3,91.7
12/22/2017 4:00,2017,12,22,4,109.05
12/22/2017 5:00,2017,12,22,5,115.03
12/22/2017 6:00,2017,12,22,6,99.78
12/22/2017 7:00,2017,12,22,7,88.43
12/22/2017 8:00,2017,12,22,8,76.28
12/22/2017 9:00,2017,12,22,9,69.96
12/22/2017 11:00,2017,12,22,11,63.49
12/22/2017 12:00,2017,12,22,12,63.73
12/22/2017 14:00,2017,12,22,14,88.68
12/22/2017 15:00,2017,12,22,15,104.71
12/22/2017 16:00,2017,12,22,16,112.72
12/22/2017 18:00,2017,12,22,18,107.13
12/22/2017 19:00,2017,12,22,19,106.39
12/22/2017 20:00,2017,12,22,20,93.66
12/22/2017 21:00,2017,12,22,21,89.72
12/22/2017 22:00,2017,12,22,22,82.18
12/22/2017 23:00,2017,12,22,23,75.26
12/23/2017 0:00,2017,12,23,0,77.04
12/23/2017 1:00,2017,12,23,1,75.28
12/23/2017 2:00,2017,12,23,2,79.98
12/23/2017 3:00,2017,12,23,3,89.71
12/23/2017 4:00,2017,12,23,4,101.68
12/23/2017 5:00,2017,12,23,5,103.68
12/23/2017 6:00,2017,12,23,6,92.47
12/23/2017 7:00,2017,12,23,7,85.12
12/23/2017 8:00,2017,12,23,8,77.15
12/23/2017 9:00,2017,12,23,9,62.28
12/23/2017 10:00,2017,12,23,10,56.4
12/23/2017 11:00,2017,12,23,11,53.39
12/23/2017 12:00,2017,12,23,12,56.94
12/23/2017 13:00,2017,12,23,13,65.23
12/23/2017 14:00,2017,12,23,14,81.57
12/23/2017 15:00,2017,12,23,15,108.84
12/23/2017 16:00,2017,12,23,16,118
12/23/2017 17:00,2017,12,23,17,127.48
12/23/2017 18:00,2017,12,23,18,126.1
12/23/2017 19:00,2017,12,23,19,125.56
12/23/2017 20:00,2017,12,23,20,110.73
12/23/2017 21:00,2017,12,23,21,99.61
12/23/2017 22:00,2017,12,23,22,93.04
12/23/2017 23:00,2017,12,23,23,95.03
12/24/2017 0:00,2017,12,24,0,85.36
12/24/2017 1:00,2017,12,24,1,84.64
12/24/2017 2:00,2017,12,24,2,89.76
12/24/2017 3:00,2017,12,24,3,101.48
12/24/2017 4:00,2017,12,24,4,113.8
12/24/2017 5:00,2017,12,24,5,112.9
12/24/2017 6:00,2017,12,24,6,105.41
12/24/2017 7:00,2017,12,24,7,92.45
12/24/2017 8:00,2017,12,24,8,84.29
12/24/2017 9:00,2017,12,24,9,68.18
12/24/2017 10:00,2017,12,24,10,60.95
12/24/2017 11:00,2017,12,24,11,56.99
12/24/2017 12:00,2017,12,24,12,57.92
12/24/2017 13:00,2017,12,24,13,65.1
12/24/2017 14:00,2017,12,24,14,78.25
12/24/2017 15:00,2017,12,24,15,94.49
12/24/2017 16:00,2017,12,24,16,109.93
12/24/2017 17:00,2017,12,24,17,131.64
12/24/2017 18:00,2017,12,24,18,117.46
12/24/2017 19:00,2017,12,24,19,119.07
12/24/2017 20:00,2017,12,24,20,110.66
12/24/2017 23:00,2017,12,24,23,91.98
12/25/2017 0:00,2017,12,25,0,87.97
12/25/2017 3:00,2017,12,25,3,97.33
12/25/2017 4:00,2017,12,25,4,108.66
12/25/2017 5:00,2017,12,25,5,119.58
12/25/2017 6:00,2017,12,25,6,120.84
12/25/2017 8:00,2017,12,25,8,83.87
12/25/2017 9:00,2017,12,25,9,74.19
12/25/2017 10:00,2017,12,25,10,69.64
12/25/2017 11:00,2017,12,25,11,64.75
12/25/2017 12:00,2017,12,25,12,64.58
12/25/2017 13:00,2017,12,25,13,69.66
12/25/2017 14:00,2017,12,25,14,89.08
12/25/2017 15:00,2017,12,25,15,107.11
12/25/2017 16:00,2017,12,25,16,110.76
12/25/2017 17:00,2017,12,25,17,114.87
12/25/2017 18:00,2017,12,25,18,113
12/25/2017 19:00,2017,12,25,19,112.7
12/25/2017 20:00,2017,12,25,20,104.31
12/25/2017 21:00,2017,12,25,21,97.61
12/25/2017 22:00,2017,12,25,22,91.53
12/25/2017 23:00,2017,12,25,23,87.43
12/26/2017 0:00,2017,12,26,0,84.1
12/26/2017 1:00,2017,12,26,1,84.59
12/26/2017 2:00,2017,12,26,2,89.08
12/26/2017 3:00,2017,12,26,3,98.19
12/26/2017 4:00,2017,12,26,4,112.67
12/26/2017 5:00,2017,12,26,5,117.28
12/26/2017 6:00,2017,12,26,6,106.8
12/26/2017 7:00,2017,12,26,7,94.96
12/26/2017 8:00,2017,12,26,8,83.46
12/26/2017 9:00,2017,12,26,9,75.98
12/26/2017 10:00,2017,12,26,10,70.05
12/26/2017 11:00,2017,12,26,11,60.56
12/26/2017 12:00,2017,12,26,12,65.09
12/26/2017 13:00,2017,12,26,13,72.44
12/26/2017 14:00,2017,12,26,14,93.8
12/26/2017 15:00,2017,12,26,15,123.79
12/26/2017 16:00,2017,12,26,16,140.44
12/26/2017 17:00,2017,12,26,17,154.58
12/26/2017 18:00,2017,12,26,18,150.76
12/26/2017 19:00,2017,12,26,19,140.54
12/26/2017 20:00,2017,12,26,20,114.67
12/26/2017 21:00,2017,12,26,21,113.52
12/26/2017 22:00,2017,12,26,22,104.62
12/26/2017 23:00,2017,12,26,23,97.92
12/27/2017 0:00,2017,12,27,0,90.51
12/27/2017 1:00,2017,12,27,1,91.93
12/27/2017 2:00,2017,12,27,2,98.41
12/27/2017 3:00,2017,12,27,3,104.59
12/27/2017 4:00,2017,12,27,4,115.59
12/27/2017 5:00,2017,12,27,5,119.09
12/27/2017 6:00,2017,12,27,6,113.51
12/27/2017 7:00,2017,12,27,7,102.24
12/27/2017 8:00,2017,12,27,8,94.44
12/27/2017 9:00,2017,12,27,9,88.57
12/27/2017 10:00,2017,12,27,10,77.67
12/27/2017 11:00,2017,12,27,11,77.03
12/27/2017 12:00,2017,12,27,12,77.15
12/27/2017 13:00,2017,12,27,13,89.24
12/27/2017 14:00,2017,12,27,14,103.34
12/27/2017 15:00,2017,12,27,15,133.03
12/27/2017 19:00,2017,12,27,19,158.3
12/27/2017 20:00,2017,12,27,20,143.39
12/27/2017 21:00,2017,12,27,21,130.03
12/27/2017 22:00,2017,12,27,22,115.29
12/27/2017 23:00,2017,12,27,23,100.55
12/28/2017 0:00,2017,12,28,0,92.19
12/28/2017 1:00,2017,12,28,1,89.21
12/28/2017 2:00,2017,12,28,2,93.87
12/28/2017 3:00,2017,12,28,3,114.03
12/28/2017 4:00,2017,12,28,4,137.66
12/28/2017 5:00,2017,12,28,5,143.54
12/28/2017 6:00,2017,12,28,6,143.02
12/28/2017 7:00,2017,12,28,7,120.43
12/28/2017 8:00,2017,12,28,8,114.3
12/28/2017 9:00,2017,12,28,9,98.63
12/28/2017 10:00,2017,12,28,10,75.57
12/28/2017 11:00,2017,12,28,11,75.43
12/28/2017 12:00,2017,12,28,12,81.4
12/28/2017 13:00,2017,12,28,13,91.64
12/28/2017 14:00,2017,12,28,14,107.13
12/28/2017 15:00,2017,12,28,15,126.85
12/28/2017 16:00,2017,12,28,16,142.57
12/28/2017 17:00,2017,12,28,17,151.96
12/28/2017 18:00,2017,12,28,18,149.37
12/28/2017 19:00,2017,12,28,19,144.31
12/28/2017 20:00,2017,12,28,20,128.68
12/28/2017 21:00,2017,12,28,21,107.01
12/28/2017 22:00,2017,12,28,22,88.68
12/28/2017 23:00,2017,12,28,23,83.97
12/29/2017 0:00,2017,12,29,0,83.18
12/29/2017 1:00,2017,12,29,1,81.27
12/29/2017 2:00,2017,12,29,2,85.97
12/29/2017 3:00,2017,12,29,3,94.87
12/29/2017 4:00,2017,12,29,4,111.15
12/29/2017 5:00,2017,12,29,5,104.55
12/29/2017 6:00,2017,12,29,6,110.62
12/29/2017 7:00,2017,12,29,7,112.73
12/29/2017 8:00,2017,12,29,8,108.09
12/29/2017 9:00,2017,12,29,9,85.53
12/29/2017 10:00,2017,12,29,10,84.98
12/29/2017 11:00,2017,12,29,11,76
12/29/2017 12:00,2017,12,29,12,75.74
12/29/2017 13:00,2017,12,29,13,81.83
12/29/2017 14:00,2017,12,29,14,96.2
12/29/2017 15:00,2017,12,29,15,116.21
12/29/2017 16:00,2017,12,29,16,127.2
12/29/2017 17:00,2017,12,29,17,136.02
12/29/2017 18:00,2017,12,29,18,136.09
12/29/2017 19:00,2017,12,29,19,126
12/29/2017 20:00,2017,12,29,20,117.83
12/29/2017 21:00,2017,12,29,21,114.05
12/29/2017 22:00,2017,12,29,22,98.01
12/29/2017 23:00,2017,12,29,23,90.81
12/30/2017 0:00,2017,12,30,0,89.3
12/30/2017 1:00,2017,12,30,1,85.12
12/30/2017 2:00,2017,12,30,2,91.84
12/30/2017 3:00,2017,12,30,3,100.77
12/30/2017 4:00,2017,12,30,4,109.36
12/30/2017 5:00,2017,12,30,5,111.53
12/30/2017 6:00,2017,12,30,6,109.7
12/30/2017 7:00,2017,12,30,7,107.9
12/30/2017 8:00,2017,12,30,8,98.94
12/30/2017 9:00,2017,12,30,9,89.28
12/30/2017 10:00,2017,12,30,10,82.38
12/30/2017 11:00,2017,12,30,11,71.31
12/30/2017 12:00,2017,12,30,12,71.43
12/30/2017 13:00,2017,12,30,13,80.19
12/30/2017 14:00,2017,12,30,14,97.42
12/30/2017 15:00,2017,12,30,15,115.66
12/30/2017 16:00,2017,12,30,16,130.42
12/30/2017 17:00,2017,12,30,17,128
12/30/2017 18:00,2017,12,30,18,128.4
12/30/2017 19:00,2017,12,30,19,120.34
12/30/2017 20:00,2017,12,30,20,105.76
12/30/2017 21:00,2017,12,30,21,100.89
12/30/2017 22:00,2017,12,30,22,93.69
12/30/2017 23:00,2017,12,30,23,91.46
12/31/2017 0:00,2017,12,31,0,83.14
12/31/2017 1:00,2017,12,31,1,82.77
12/31/2017 2:00,2017,12,31,2,85.91
12/31/2017 3:00,2017,12,31,3,95.14
12/31/2017 4:00,2017,12,31,4,98.9
12/31/2017 5:00,2017,12,31,5,109.91
12/31/2017 6:00,2017,12,31,6,112.99
12/31/2017 7:00,2017,12,31,7,101.66
12/31/2017 8:00,2017,12,31,8,92.31
12/31/2017 9:00,2017,12,31,9,88.21
12/31/2017 10:00,2017,12,31,10,81.45
12/31/2017 11:00,2017,12,31,11,72.26
12/31/2017 12:00,2017,12,31,12,72.41
12/31/2017 13:00,2017,12,31,13,77.59
12/31/2017 14:00,2017,12,31,14,95.05
12/31/2017 15:00,2017,12,31,15,112.79
12/31/2017 16:00,2017,12,31,16,127.1
12/31/2017 17:00,2017,12,31,17,134.91
12/31/2017 19:00,2017,12,31,19,133.86
12/31/2017 20:00,2017,12,31,20,120.65
12/31/2017 21:00,2017,12,31,21,114.6
12/31/2017 22:00,2017,12,31,22,109.29
12/31/2017 23:00,2017,12,31,23,99.05
1/1/2018 0:00,2018,1,1,0,90.19
1/1/2018 1:00,2018,1,1,1,86.98
1/1/2018 2:00,2018,1,1,2,86.06
1/1/2018 3:00,2018,1,1,3,94.04
1/1/2018 4:00,2018,1,1,4,108.78
1/1/2018 5:00,2018,1,1,5,117.86
1/1/2018 6:00,2018,1,1,6,128.07
1/1/2018 7:00,2018,1,1,7,121.66
1/1/2018 8:00,2018,1,1,8,106.7
1/1/2018 9:00,2018,1,1,9,92.45
1/1/2018 10:00,2018,1,1,10,86.3
1/1/2018 11:00,2018,1,1,11,81.89
1/1/2018 12:00,2018,1,1,12,85.25
1/1/2018 13:00,2018,1,1,13,90.22
1/1/2018 14:00,2018,1,1,14,96.85
1/1/2018 15:00,2018,1,1,15,115.41
1/1/2018 16:00,2018,1,1,16,121.05
1/1/2018 17:00,2018,1,1,17,116.76
1/1/2018 18:00,2018,1,1,18,111.28
1/1/2018 19:00,2018,1,1,19,104.21
1/1/2018 20:00,2018,1,1,20,90.63
1/1/2018 21:00,2018,1,1,21,83.88
1/1/2018 22:00,2018,1,1,22,78.86
1/1/2018 23:00,2018,1,1,23,76.2
1/2/2018 0:00,2018,1,2,0,75.76
1/2/2018 1:00,2018,1,2,1,76.48
1/2/2018 2:00,2018,1,2,2,80.66
1/2/2018 3:00,2018,1,2,3,84.68
1/2/2018 4:00,2018,1,2,4,92.51
1/2/2018 5:00,2018,1,2,5,98.93
1/2/2018 6:00,2018,1,2,6,103.04
1/2/2018 7:00,2018,1,2,7,99.91
1/2/2018 8:00,2018,1,2,8,97.03
1/2/2018 9:00,2018,1,2,9,101.09
1/2/2018 10:00,2018,1,2,10,94.01
1/2/2018 11:00,2018,1,2,11,90.61
1/2/2018 12:00,2018,1,2,12,86.2
1/2/2018 13:00,2018,1,2,13,104.18
1/2/2018 14:00,2018,1,2,14,112.16
1/2/2018 15:00,2018,1,2,15,129.94
1/2/2018 16:00,2018,1,2,16,136.21
1/2/2018 17:00,2018,1,2,17,136.08
1/2/2018 18:00,2018,1,2,18,128.78
1/2/2018 19:00,2018,1,2,19,124.77
1/2/2018 20:00,2018,1,2,20,101.05
1/2/2018 21:00,2018,1,2,21,93.53
1/2/2018 22:00,2018,1,2,22,83.31
1/2/2018 23:00,2018,1,2,23,75.74
1/3/2018 0:00,2018,1,3,0,77.32
1/3/2018 1:00,2018,1,3,1,76.97
1/3/2018 2:00,2018,1,3,2,76.84
1/3/2018 3:00,2018,1,3,3,85.66
1/3/2018 4:00,2018,1,3,4,95.36
1/3/2018 5:00,2018,1,3,5,98.47
1/3/2018 6:00,2018,1,3,6,98.06
1/3/2018 7:00,2018,1,3,7,96.64
1/3/2018 8:00,2018,1,3,8,90.98
1/3/2018 9:00,2018,1,3,9,90.47
1/3/2018 10:00,2018,1,3,10,85.67
1/3/2018 11:00,2018,1,3,11,83.16
1/3/2018 12:00,2018,1,3,12,89.71
1/3/2018 13:00,2018,1,3,13,90.47
1/3/2018 14:00,2018,1,3,14,100.52
1/3/2018 15:00,2018,1,3,15,125.07
1/3/2018 16:00,2018,1,3,16,132.89
1/3/2018 17:00,2018,1,3,17,131.41
1/3/2018 18:00,2018,1,3,18,123.21
1/3/2018 19:00,2018,1,3,19,119.62
1/3/2018 20:00,2018,1,3,20,117
1/3/2018 21:00,2018,1,3,21,102.92
1/3/2018 22:00,2018,1,3,22,89.38
1/3/2018 23:00,2018,1,3,23,82.55
1/4/2018 0:00,2018,1,4,0,76.81
1/4/2018 1:00,2018,1,4,1,74.34
1/4/2018 2:00,2018,1,4,2,74.99
1/4/2018 3:00,2018,1,4,3,87.01
1/4/2018 4:00,2018,1,4,4,101.49
1/4/2018 5:00,2018,1,4,5,105.4
1/4/2018 6:00,2018,1,4,6,104.03
1/4/2018 7:00,2018,1,4,7,100.64
1/4/2018 8:00,2018,1,4,8,96.89
1/4/2018 9:00,2018,1,4,9,94.67
1/4/2018 10:00,2018,1,4,10,92.9
1/4/2018 11:00,2018,1,4,11,86.6
1/4/2018 12:00,2018,1,4,12,86.63
1/4/2018 13:00,2018,1,4,13,91.69
1/4/2018 14:00,2018,1,4,14,116.25
1/4/2018 15:00,2018,1,4,15,130.98
1/4/2018 16:00,2018,1,4,16,146.36
1/4/2018 17:00,2018,1,4,17,150.45
1/4/2018 18:00,2018,1,4,18,143.96
1/4/2018 19:00,2018,1,4,19,130.22
1/4/2018 20:00,2018,1,4,20,109.37
1/4/2018 21:00,2018,1,4,21,100.48
1/4/2018 22:00,2018,1,4,22,93.84
1/4/2018 23:00,2018,1,4,23,86.47
1/5/2018 0:00,2018,1,5,0,82.75
1/5/2018 1:00,2018,1,5,1,81.19
1/5/2018 2:00,2018,1,5,2,86.8
1/5/2018 3:00,2018,1,5,3,93.5
1/5/2018 4:00,2018,1,5,4,104.1
1/5/2018 5:00,2018,1,5,5,111.77
1/5/2018 6:00,2018,1,5,6,107.1
1/5/2018 7:00,2018,1,5,7,103.07
1/5/2018 8:00,2018,1,5,8,108.18
1/5/2018 9:00,2018,1,5,9,98.73
1/5/2018 10:00,2018,1,5,10,96.43
1/5/2018 11:00,2018,1,5,11,88.14
1/5/2018 12:00,2018,1,5,12,87.14
1/5/2018 13:00,2018,1,5,13,95.8
1/5/2018 14:00,2018,1,5,14,113.79
1/5/2018 15:00,2018,1,5,15,115.89
1/5/2018 16:00,2018,1,5,16,119.41
1/5/2018 17:00,2018,1,5,17,115.6
1/5/2018 18:00,2018,1,5,18,110.95
1/5/2018 19:00,2018,1,5,19,110.52
1/5/2018 20:00,2018,1,5,20,105.06
1/5/2018 21:00,2018,1,5,21,98.65
1/5/2018 22:00,2018,1,5,22,84.94
1/5/2018 23:00,2018,1,5,23,84.79
1/6/2018 0:00,2018,1,6,0,80.21
1/6/2018 1:00,2018,1,6,1,79.82
1/6/2018 2:00,2018,1,6,2,85.66
1/6/2018 3:00,2018,1,6,3,90.9
1/6/2018 5:00,2018,1,6,5,112.63
1/6/2018 6:00,2018,1,6,6,113.68
1/6/2018 7:00,2018,1,6,7,109.38
1/6/2018 8:00,2018,1,6,8,102.67
1/6/2018 9:00,2018,1,6,9,90.47
1/6/2018 10:00,2018,1,6,10,83.1
1/6/2018 11:00,2018,1,6,11,63.8
1/6/2018 12:00,2018,1,6,12,62.11
1/6/2018 13:00,2018,1,6,13,75.03
1/6/2018 14:00,2018,1,6,14,97.04
1/6/2018 15:00,2018,1,6,15,118.47
1/6/2018 16:00,2018,1,6,16,146.88
1/6/2018 17:00,2018,1,6,17,150.89
1/6/2018 18:00,2018,1,6,18,135.78
1/6/2018 19:00,2018,1,6,19,130.54
1/6/2018 20:00,2018,1,6,20,115.96
1/6/2018 21:00,2018,1,6,21,109.28
1/6/2018 22:00,2018,1,6,22,96.36
1/6/2018 23:00,2018,1,6,23,91.84
1/7/2018 0:00,2018,1,7,0,84.54
1/7/2018 1:00,2018,1,7,1,83.53
1/7/2018 2:00,2018,1,7,2,84.09
1/7/2018 3:00,2018,1,7,3,93.73
1/7/2018 4:00,2018,1,7,4,105.97
1/7/2018 5:00,2018,1,7,5,112.5
1/7/2018 6:00,2018,1,7,6,103.84
1/7/2018 7:00,2018,1,7,7,93.4
1/7/2018 8:00,2018,1,7,8,80.08
1/7/2018 9:00,2018,1,7,9,71.59
1/7/2018 10:00,2018,1,7,10,69.01
1/7/2018 11:00,2018,1,7,11,63.09
1/7/2018 12:00,2018,1,7,12,61.24
1/7/2018 13:00,2018,1,7,13,63.69
1/7/2018 14:00,2018,1,7,14,74.5
1/7/2018 16:00,2018,1,7,16,119.53
1/7/2018 17:00,2018,1,7,17,127.19
1/7/2018 18:00,2018,1,7,18,122.76
1/7/2018 19:00,2018,1,7,19,114.82
1/7/2018 20:00,2018,1,7,20,104.34
1/7/2018 21:00,2018,1,7,21,98.89
1/7/2018 22:00,2018,1,7,22,81.68
1/8/2018 6:00,2018,1,8,6,94.98
1/8/2018 8:00,2018,1,8,8,77.56
1/8/2018 9:00,2018,1,8,9,72.07
1/8/2018 10:00,2018,1,8,10,68.91
1/8/2018 12:00,2018,1,8,12,70.1
1/8/2018 13:00,2018,1,8,13,77.32
1/8/2018 14:00,2018,1,8,14,91.29
1/8/2018 15:00,2018,1,8,15,109.43
1/8/2018 16:00,2018,1,8,16,125.15
1/8/2018 17:00,2018,1,8,17,128.75
1/8/2018 18:00,2018,1,8,18,123.79
1/8/2018 19:00,2018,1,8,19,119.32
1/8/2018 20:00,2018,1,8,20,101.58
1/8/2018 21:00,2018,1,8,21,102.24
1/8/2018 22:00,2018,1,8,22,95.69
1/8/2018 23:00,2018,1,8,23,88.71
1/9/2018 0:00,2018,1,9,0,84.58
1/9/2018 1:00,2018,1,9,1,82.47
1/9/2018 4:00,2018,1,9,4,105.06
1/9/2018 5:00,2018,1,9,5,110.83
1/9/2018 6:00,2018,1,9,6,104.06
1/9/2018 7:00,2018,1,9,7,100.18
1/9/2018 8:00,2018,1,9,8,89.67
1/9/2018 9:00,2018,1,9,9,78.07
1/9/2018 10:00,2018,1,9,10,73.21
1/9/2018 11:00,2018,1,9,11,69.97
1/9/2018 12:00,2018,1,9,12,66.48
1/9/2018 13:00,2018,1,9,13,80.1
1/9/2018 14:00,2018,1,9,14,100.29
1/9/2018 15:00,2018,1,9,15,116.45
1/9/2018 16:00,2018,1,9,16,128.65
1/9/2018 17:00,2018,1,9,17,137.54
1/9/2018 18:00,2018,1,9,18,129.45
1/9/2018 19:00,2018,1,9,19,130.18
1/9/2018 20:00,2018,1,9,20,110.8
1/9/2018 21:00,2018,1,9,21,113.41
1/9/2018 22:00,2018,1,9,22,98.12
1/9/2018 23:00,2018,1,9,23,86.67
1/10/2018 0:00,2018,1,10,0,86.54
1/10/2018 1:00,2018,1,10,1,88.1
1/10/2018 2:00,2018,1,10,2,86.19
1/10/2018 3:00,2018,1,10,3,90.84
1/10/2018 4:00,2018,1,10,4,108.43
1/10/2018 5:00,2018,1,10,5,121.2
1/10/2018 6:00,2018,1,10,6,114.74
1/10/2018 7:00,2018,1,10,7,93.55
1/10/2018 8:00,2018,1,10,8,86.81
1/10/2018 9:00,2018,1,10,9,79.98
1/10/2018 10:00,2018,1,10,10,73.96
1/10/2018 11:00,2018,1,10,11,74.23
1/10/2018 12:00,2018,1,10,12,70.7
1/10/2018 13:00,2018,1,10,13,81.09
1/10/2018 14:00,2018,1,10,14,92.13
1/10/2018 15:00,2018,1,10,15,113.51
1/10/2018 16:00,2018,1,10,16,121.83
1/10/2018 17:00,2018,1,10,17,124.47
1/10/2018 18:00,2018,1,10,18,118.72
1/10/2018 19:00,2018,1,10,19,114.88
1/10/2018 20:00,2018,1,10,20,105.05
1/10/2018 21:00,2018,1,10,21,97.48
1/10/2018 22:00,2018,1,10,22,90.37
1/10/2018 23:00,2018,1,10,23,81.28
1/11/2018 0:00,2018,1,11,0,80.62
1/11/2018 1:00,2018,1,11,1,80.37
1/11/2018 2:00,2018,1,11,2,87.21
1/11/2018 3:00,2018,1,11,3,96.02
1/11/2018 4:00,2018,1,11,4,108.6
1/11/2018 5:00,2018,1,11,5,110.99
1/11/2018 6:00,2018,1,11,6,101.37
1/11/2018 7:00,2018,1,11,7,95.29
1/11/2018 8:00,2018,1,11,8,82.61
1/11/2018 9:00,2018,1,11,9,75.15
1/11/2018 10:00,2018,1,11,10,67.64
1/11/2018 13:00,2018,1,11,13,81.31
1/11/2018 14:00,2018,1,11,14,96.17
1/11/2018 15:00,2018,1,11,15,128.37
1/11/2018 16:00,2018,1,11,16,136.59
1/11/2018 17:00,2018,1,11,17,141.55
1/11/2018 18:00,2018,1,11,18,139.95
1/11/2018 19:00,2018,1,11,19,134.21
1/11/2018 20:00,2018,1,11,20,125.51
1/11/2018 21:00,2018,1,11,21,109.26
1/11/2018 22:00,2018,1,11,22,103.26
1/11/2018 23:00,2018,1,11,23,92.09
1/12/2018 0:00,2018,1,12,0,87.4
1/12/2018 1:00,2018,1,12,1,85.45
1/12/2018 4:00,2018,1,12,4,114.57
1/12/2018 5:00,2018,1,12,5,123.47
1/12/2018 6:00,2018,1,12,6,119.76
1/12/2018 7:00,2018,1,12,7,112.08
1/12/2018 8:00,2018,1,12,8,100.76
1/12/2018 9:00,2018,1,12,9,91.84
1/12/2018 10:00,2018,1,12,10,92.18
1/12/2018 11:00,2018,1,12,11,76.88
1/12/2018 12:00,2018,1,12,12,82.59
1/12/2018 13:00,2018,1,12,13,89.21
1/12/2018 14:00,2018,1,12,14,94.11
1/12/2018 15:00,2018,1,12,15,106.4
1/12/2018 16:00,2018,1,12,16,120.36
1/12/2018 17:00,2018,1,12,17,124.96
1/12/2018 18:00,2018,1,12,18,125.92
1/12/2018 19:00,2018,1,12,19,119.57
1/12/2018 20:00,2018,1,12,20,117.94
1/12/2018 21:00,2018,1,12,21,112.98
1/12/2018 22:00,2018,1,12,22,98.44
1/13/2018 1:00,2018,1,13,1,81.47
1/13/2018 2:00,2018,1,13,2,91.72
1/13/2018 3:00,2018,1,13,3,94.47
1/13/2018 4:00,2018,1,13,4,106.55
1/13/2018 5:00,2018,1,13,5,114.18
1/13/2018 7:00,2018,1,13,7,104.15
1/13/2018 8:00,2018,1,13,8,96.89
1/13/2018 9:00,2018,1,13,9,89.09
1/13/2018 10:00,2018,1,13,10,84.02
1/13/2018 11:00,2018,1,13,11,78.09
1/13/2018 12:00,2018,1,13,12,76.85
1/13/2018 13:00,2018,1,13,13,87.01
1/13/2018 14:00,2018,1,13,14,102.87
1/13/2018 15:00,2018,1,13,15,135.34
1/13/2018 16:00,2018,1,13,16,165.45
1/13/2018 17:00,2018,1,13,17,177.58
1/13/2018 18:00,2018,1,13,18,175.32
1/13/2018 19:00,2018,1,13,19,166.6
1/13/2018 20:00,2018,1,13,20,137.9
1/13/2018 21:00,2018,1,13,21,112.13
1/13/2018 22:00,2018,1,13,22,104.37
1/13/2018 23:00,2018,1,13,23,96.37
1/14/2018 0:00,2018,1,14,0,94.68
1/14/2018 1:00,2018,1,14,1,97.03
1/14/2018 2:00,2018,1,14,2,109.92
1/14/2018 3:00,2018,1,14,3,123.62
1/14/2018 4:00,2018,1,14,4,129.17
1/14/2018 5:00,2018,1,14,5,125.53
1/14/2018 6:00,2018,1,14,6,120.99
1/14/2018 7:00,2018,1,14,7,103.96
1/14/2018 8:00,2018,1,14,8,94.26
1/14/2018 9:00,2018,1,14,9,84.45
1/14/2018 10:00,2018,1,14,10,78.52
1/14/2018 11:00,2018,1,14,11,68.74
1/14/2018 12:00,2018,1,14,12,71.43
1/14/2018 13:00,2018,1,14,13,83.11
1/14/2018 14:00,2018,1,14,14,95.7
1/14/2018 15:00,2018,1,14,15,125.23
1/14/2018 16:00,2018,1,14,16,133.44
1/14/2018 17:00,2018,1,14,17,134.7
1/14/2018 18:00,2018,1,14,18,132.69
1/14/2018 19:00,2018,1,14,19,128.66
1/14/2018 20:00,2018,1,14,20,121.78
1/14/2018 21:00,2018,1,14,21,109
1/14/2018 22:00,2018,1,14,22,100.03
1/14/2018 23:00,2018,1,14,23,89.98
1/15/2018 0:00,2018,1,15,0,84.24
1/15/2018 1:00,2018,1,15,1,78.32
1/15/2018 2:00,2018,1,15,2,79.31
1/15/2018 3:00,2018,1,15,3,90
1/15/2018 4:00,2018,1,15,4,100.59
1/15/2018 5:00,2018,1,15,5,110.95
1/15/2018 6:00,2018,1,15,6,104.25
1/15/2018 7:00,2018,1,15,7,85.63
1/15/2018 9:00,2018,1,15,9,72.5
1/15/2018 10:00,2018,1,15,10,69.92
1/15/2018 11:00,2018,1,15,11,69.92
1/15/2018 12:00,2018,1,15,12,66.14
1/15/2018 13:00,2018,1,15,13,69.56
1/15/2018 14:00,2018,1,15,14,84.94
1/15/2018 15:00,2018,1,15,15,106.36
1/15/2018 16:00,2018,1,15,16,122.21
1/15/2018 17:00,2018,1,15,17,129.74
1/15/2018 18:00,2018,1,15,18,118.52
1/15/2018 19:00,2018,1,15,19,112.68
1/15/2018 20:00,2018,1,15,20,105.53
1/15/2018 21:00,2018,1,15,21,95.23
1/15/2018 22:00,2018,1,15,22,85.17
1/15/2018 23:00,2018,1,15,23,81.5
1/16/2018 0:00,2018,1,16,0,71.58
1/16/2018 1:00,2018,1,16,1,70.33
1/16/2018 2:00,2018,1,16,2,80.3
1/16/2018 3:00,2018,1,16,3,88.73
1/16/2018 4:00,2018,1,16,4,107.62
1/16/2018 5:00,2018,1,16,5,117.31
1/16/2018 6:00,2018,1,16,6,105.11
1/16/2018 7:00,2018,1,16,7,86.96
1/16/2018 8:00,2018,1,16,8,80.24
1/16/2018 9:00,2018,1,16,9,78.18
1/16/2018 10:00,2018,1,16,10,69.16
1/16/2018 11:00,2018,1,16,11,69.36
1/16/2018 12:00,2018,1,16,12,71.14
1/16/2018 13:00,2018,1,16,13,77.95
1/16/2018 14:00,2018,1,16,14,91.91
1/16/2018 16:00,2018,1,16,16,127.01
1/16/2018 17:00,2018,1,16,17,137.48
1/16/2018 19:00,2018,1,16,19,136.77
1/16/2018 20:00,2018,1,16,20,108.82
1/16/2018 21:00,2018,1,16,21,101.06
1/16/2018 22:00,2018,1,16,22,94.04
1/17/2018 0:00,2018,1,17,0,82.89
1/17/2018 1:00,2018,1,17,1,81.5
1/17/2018 2:00,2018,1,17,2,85.21
1/17/2018 3:00,2018,1,17,3,95.74
1/17/2018 4:00,2018,1,17,4,106.95
1/17/2018 5:00,2018,1,17,5,115.99
1/17/2018 6:00,2018,1,17,6,111.81
1/17/2018 7:00,2018,1,17,7,103.59
1/17/2018 8:00,2018,1,17,8,104.8
1/17/2018 9:00,2018,1,17,9,87.73
1/17/2018 10:00,2018,1,17,10,80.37
1/17/2018 13:00,2018,1,17,13,79.51
1/17/2018 14:00,2018,1,17,14,100.71
1/17/2018 15:00,2018,1,17,15,119.47
1/17/2018 16:00,2018,1,17,16,130.52
1/17/2018 17:00,2018,1,17,17,116.11
1/17/2018 18:00,2018,1,17,18,131.64
1/17/2018 19:00,2018,1,17,19,126.87
1/17/2018 20:00,2018,1,17,20,108.48
1/17/2018 21:00,2018,1,17,21,96.76
1/17/2018 22:00,2018,1,17,22,92.35
1/17/2018 23:00,2018,1,17,23,84.16
1/18/2018 2:00,2018,1,18,2,83.01
1/18/2018 3:00,2018,1,18,3,91.15
1/18/2018 4:00,2018,1,18,4,106.55
1/18/2018 5:00,2018,1,18,5,121.89
1/18/2018 6:00,2018,1,18,6,117.25
1/18/2018 7:00,2018,1,18,7,98.34
1/18/2018 8:00,2018,1,18,8,88.53
1/18/2018 9:00,2018,1,18,9,75.96
1/18/2018 10:00,2018,1,18,10,71.54
1/18/2018 11:00,2018,1,18,11,65.82
1/18/2018 12:00,2018,1,18,12,74.35
1/18/2018 13:00,2018,1,18,13,82.42
1/18/2018 14:00,2018,1,18,14,98.95
1/18/2018 15:00,2018,1,18,15,113.82
1/18/2018 18:00,2018,1,18,18,131.88
1/18/2018 19:00,2018,1,18,19,133.73
1/18/2018 20:00,2018,1,18,20,115.4
1/18/2018 21:00,2018,1,18,21,105.36
1/18/2018 23:00,2018,1,18,23,91.43
1/19/2018 0:00,2018,1,19,0,88.55
1/19/2018 1:00,2018,1,19,1,90.56
1/19/2018 2:00,2018,1,19,2,96.14
1/19/2018 3:00,2018,1,19,3,100.08
1/19/2018 4:00,2018,1,19,4,111.79
1/19/2018 5:00,2018,1,19,5,109.45
1/19/2018 6:00,2018,1,19,6,116.56
1/19/2018 7:00,2018,1,19,7,89.99
1/19/2018 8:00,2018,1,19,8,79.58
1/19/2018 9:00,2018,1,19,9,74.18
1/19/2018 10:00,2018,1,19,10,68.36
1/19/2018 11:00,2018,1,19,11,62.35
1/19/2018 12:00,2018,1,19,12,59.76
1/19/2018 14:00,2018,1,19,14,81.56
1/19/2018 15:00,2018,1,19,15,98.57
1/19/2018 16:00,2018,1,19,16,111.54
1/19/2018 17:00,2018,1,19,17,113.19
1/19/2018 18:00,2018,1,19,18,108.85
1/19/2018 19:00,2018,1,19,19,106.92
1/19/2018 20:00,2018,1,19,20,97.62
1/19/2018 21:00,2018,1,19,21,95.29
1/19/2018 22:00,2018,1,19,22,84.76
1/19/2018 23:00,2018,1,19,23,77.09
1/20/2018 0:00,2018,1,20,0,77.1
1/20/2018 1:00,2018,1,20,1,78.62
1/20/2018 2:00,2018,1,20,2,78.54
1/20/2018 3:00,2018,1,20,3,84.68
1/20/2018 4:00,2018,1,20,4,97.22
1/20/2018 5:00,2018,1,20,5,96.73
1/20/2018 6:00,2018,1,20,6,90.99
1/20/2018 7:00,2018,1,20,7,81.76
1/20/2018 8:00,2018,1,20,8,68.08
1/20/2018 9:00,2018,1,20,9,65.12
1/20/2018 10:00,2018,1,20,10,57.59
1/20/2018 11:00,2018,1,20,11,56.08
1/20/2018 12:00,2018,1,20,12,55.65
1/20/2018 13:00,2018,1,20,13,61.61
1/20/2018 14:00,2018,1,20,14,76.77
1/20/2018 15:00,2018,1,20,15,99.11
1/20/2018 16:00,2018,1,20,16,111.53
1/20/2018 17:00,2018,1,20,17,114.04
1/20/2018 18:00,2018,1,20,18,110.61
1/20/2018 19:00,2018,1,20,19,107.34
1/20/2018 20:00,2018,1,20,20,97.6
1/20/2018 21:00,2018,1,20,21,93.77
1/20/2018 22:00,2018,1,20,22,91.45
1/20/2018 23:00,2018,1,20,23,88.72
1/21/2018 0:00,2018,1,21,0,84.04
1/21/2018 1:00,2018,1,21,1,82.43
1/21/2018 2:00,2018,1,21,2,85.5
1/21/2018 3:00,2018,1,21,3,93.09
1/21/2018 4:00,2018,1,21,4,111.45
1/21/2018 5:00,2018,1,21,5,106.29
1/21/2018 6:00,2018,1,21,6,102.24
1/21/2018 7:00,2018,1,21,7,87.79
1/21/2018 8:00,2018,1,21,8,78.02
1/21/2018 9:00,2018,1,21,9,67.41
1/21/2018 10:00,2018,1,21,10,64.35
1/21/2018 11:00,2018,1,21,11,59.73
1/21/2018 12:00,2018,1,21,12,58.53
1/21/2018 13:00,2018,1,21,13,61.35
1/21/2018 14:00,2018,1,21,14,73.23
1/21/2018 15:00,2018,1,21,15,92.91
1/21/2018 16:00,2018,1,21,16,102.28
1/21/2018 17:00,2018,1,21,17,115.71
1/21/2018 18:00,2018,1,21,18,117.02
1/21/2018 19:00,2018,1,21,19,112.78
1/21/2018 20:00,2018,1,21,20,101.08
1/21/2018 21:00,2018,1,21,21,93.94
1/21/2018 22:00,2018,1,21,22,91.74
1/21/2018 23:00,2018,1,21,23,84.68
1/22/2018 1:00,2018,1,22,1,85.28
1/22/2018 2:00,2018,1,22,2,90.31
1/22/2018 3:00,2018,1,22,3,104.83
1/22/2018 4:00,2018,1,22,4,113.17
1/22/2018 5:00,2018,1,22,5,118.3
1/22/2018 6:00,2018,1,22,6,95.82
1/22/2018 7:00,2018,1,22,7,88.58
1/22/2018 8:00,2018,1,22,8,79.49
1/22/2018 9:00,2018,1,22,9,71.26
1/22/2018 10:00,2018,1,22,10,66.13
1/22/2018 11:00,2018,1,22,11,58.94
1/22/2018 12:00,2018,1,22,12,67.73
1/22/2018 13:00,2018,1,22,13,65.98
1/22/2018 14:00,2018,1,22,14,82.19
1/22/2018 15:00,2018,1,22,15,95.66
1/22/2018 17:00,2018,1,22,17,112.09
1/22/2018 18:00,2018,1,22,18,108.99
1/22/2018 19:00,2018,1,22,19,108.1
1/22/2018 20:00,2018,1,22,20,105.77
1/22/2018 22:00,2018,1,22,22,98.08
1/22/2018 23:00,2018,1,22,23,94.17
1/23/2018 0:00,2018,1,23,0,89.07
1/23/2018 1:00,2018,1,23,1,86.22
1/23/2018 2:00,2018,1,23,2,84.29
1/23/2018 3:00,2018,1,23,3,90.09
1/23/2018 4:00,2018,1,23,4,95.58
1/23/2018 5:00,2018,1,23,5,98.37
1/23/2018 6:00,2018,1,23,6,85.38
1/23/2018 7:00,2018,1,23,7,79.72
1/23/2018 8:00,2018,1,23,8,73.53
1/23/2018 9:00,2018,1,23,9,72.05
1/23/2018 10:00,2018,1,23,10,70.01
1/23/2018 11:00,2018,1,23,11,65.55
1/23/2018 12:00,2018,1,23,12,73.24
1/23/2018 14:00,2018,1,23,14,86.4
1/23/2018 15:00,2018,1,23,15,97.97
1/23/2018 16:00,2018,1,23,16,98.66
1/23/2018 17:00,2018,1,23,17,98.9
1/23/2018 18:00,2018,1,23,18,95.66
1/23/2018 19:00,2018,1,23,19,88.51
1/23/2018 20:00,2018,1,23,20,80.24
1/23/2018 21:00,2018,1,23,21,78.28
1/23/2018 22:00,2018,1,23,22,75.32
1/23/2018 23:00,2018,1,23,23,75.49
1/24/2018 0:00,2018,1,24,0,76.65
1/24/2018 1:00,2018,1,24,1,75.76
1/24/2018 2:00,2018,1,24,2,78.55
1/24/2018 3:00,2018,1,24,3,86.22
1/24/2018 4:00,2018,1,24,4,96.78
1/24/2018 5:00,2018,1,24,5,96.81
1/24/2018 6:00,2018,1,24,6,98.82
1/24/2018 7:00,2018,1,24,7,93.75
1/24/2018 8:00,2018,1,24,8,76.71
1/24/2018 9:00,2018,1,24,9,65.46
1/24/2018 10:00,2018,1,24,10,62.44
1/24/2018 11:00,2018,1,24,11,78.25
1/24/2018 12:00,2018,1,24,12,78.72
1/24/2018 13:00,2018,1,24,13,65.94
1/24/2018 14:00,2018,1,24,14,74.82
1/24/2018 15:00,2018,1,24,15,85.24
1/24/2018 16:00,2018,1,24,16,92.74
1/24/2018 17:00,2018,1,24,17,97.46
1/24/2018 18:00,2018,1,24,18,95.79
1/24/2018 19:00,2018,1,24,19,95.32
1/24/2018 20:00,2018,1,24,20,84.25
1/24/2018 21:00,2018,1,24,21,75.96
1/24/2018 22:00,2018,1,24,22,71.87
1/24/2018 23:00,2018,1,24,23,68.41
1/25/2018 0:00,2018,1,25,0,68.25
1/25/2018 1:00,2018,1,25,1,66.41
1/25/2018 2:00,2018,1,25,2,66.06
1/25/2018 3:00,2018,1,25,3,76.3
1/25/2018 4:00,2018,1,25,4,83.68
1/25/2018 5:00,2018,1,25,5,85.6
1/25/2018 6:00,2018,1,25,6,82.57
1/25/2018 7:00,2018,1,25,7,74.7
1/25/2018 8:00,2018,1,25,8,72.43
1/25/2018 9:00,2018,1,25,9,66.52
1/25/2018 10:00,2018,1,25,10,59.82
1/25/2018 11:00,2018,1,25,11,54.66
1/25/2018 12:00,2018,1,25,12,53.57
1/25/2018 13:00,2018,1,25,13,59.49
1/25/2018 14:00,2018,1,25,14,70.9
1/25/2018 15:00,2018,1,25,15,90.64
1/25/2018 16:00,2018,1,25,16,104.17
1/25/2018 17:00,2018,1,25,17,107.25
1/25/2018 18:00,2018,1,25,18,108.78
1/25/2018 19:00,2018,1,25,19,102.81
1/25/2018 20:00,2018,1,25,20,92.42
1/25/2018 21:00,2018,1,25,21,79.1
1/25/2018 22:00,2018,1,25,22,70.71
1/25/2018 23:00,2018,1,25,23,70.21
1/26/2018 0:00,2018,1,26,0,70.01
1/26/2018 1:00,2018,1,26,1,76.1
1/26/2018 2:00,2018,1,26,2,79.35
1/26/2018 3:00,2018,1,26,3,78.65
1/26/2018 4:00,2018,1,26,4,89.36
1/26/2018 5:00,2018,1,26,5,97.06
1/26/2018 6:00,2018,1,26,6,91.09
1/26/2018 7:00,2018,1,26,7,81.61
1/26/2018 8:00,2018,1,26,8,69.18
1/26/2018 9:00,2018,1,26,9,61.8
1/26/2018 10:00,2018,1,26,10,57.26
1/26/2018 11:00,2018,1,26,11,56.02
1/26/2018 12:00,2018,1,26,12,57.55
1/26/2018 13:00,2018,1,26,13,59.85
1/26/2018 14:00,2018,1,26,14,70.39
1/26/2018 15:00,2018,1,26,15,88.67
1/26/2018 16:00,2018,1,26,16,102.26
1/26/2018 17:00,2018,1,26,17,109.99
1/26/2018 18:00,2018,1,26,18,102.66
1/26/2018 19:00,2018,1,26,19,98.44
1/26/2018 20:00,2018,1,26,20,89.2
1/26/2018 21:00,2018,1,26,21,85.55
1/26/2018 22:00,2018,1,26,22,77.86
1/26/2018 23:00,2018,1,26,23,72.7
1/27/2018 0:00,2018,1,27,0,71.7
1/27/2018 1:00,2018,1,27,1,70.53
1/27/2018 2:00,2018,1,27,2,71.46
1/27/2018 3:00,2018,1,27,3,81.31
1/27/2018 4:00,2018,1,27,4,92.63
1/27/2018 5:00,2018,1,27,5,98.41
1/27/2018 6:00,2018,1,27,6,90.95
1/27/2018 7:00,2018,1,27,7,86.09
1/27/2018 8:00,2018,1,27,8,82.34
1/27/2018 9:00,2018,1,27,9,71.24
1/27/2018 10:00,2018,1,27,10,69.72
1/27/2018 11:00,2018,1,27,11,63.94
1/27/2018 12:00,2018,1,27,12,66.57
1/27/2018 13:00,2018,1,27,13,68.76
1/27/2018 14:00,2018,1,27,14,80.57
1/27/2018 15:00,2018,1,27,15,97.78
1/27/2018 16:00,2018,1,27,16,121.51
1/27/2018 17:00,2018,1,27,17,132.91
1/27/2018 18:00,2018,1,27,18,132.4
1/27/2018 19:00,2018,1,27,19,128.39
1/27/2018 20:00,2018,1,27,20,119.94
1/27/2018 21:00,2018,1,27,21,104.89
1/27/2018 22:00,2018,1,27,22,97.47
1/27/2018 23:00,2018,1,27,23,85.7
1/28/2018 0:00,2018,1,28,0,84.13
1/28/2018 1:00,2018,1,28,1,81.87
1/28/2018 2:00,2018,1,28,2,80.47
1/28/2018 3:00,2018,1,28,3,88.51
1/28/2018 4:00,2018,1,28,4,96.86
1/28/2018 5:00,2018,1,28,5,103.1
1/28/2018 6:00,2018,1,28,6,96.92
1/28/2018 7:00,2018,1,28,7,90.09
1/28/2018 8:00,2018,1,28,8,87.32
1/28/2018 9:00,2018,1,28,9,79.26
1/28/2018 10:00,2018,1,28,10,73.3
1/28/2018 13:00,2018,1,28,13,68.54
1/28/2018 14:00,2018,1,28,14,85
1/28/2018 15:00,2018,1,28,15,103.95
1/28/2018 16:00,2018,1,28,16,122.42
1/28/2018 17:00,2018,1,28,17,132.45
1/28/2018 18:00,2018,1,28,18,122.03
1/28/2018 19:00,2018,1,28,19,114.92
1/28/2018 20:00,2018,1,28,20,113.86
1/28/2018 21:00,2018,1,28,21,99.46
1/28/2018 22:00,2018,1,28,22,98.24
1/28/2018 23:00,2018,1,28,23,90.84
1/29/2018 0:00,2018,1,29,0,89.67
1/29/2018 1:00,2018,1,29,1,85.66
1/29/2018 5:00,2018,1,29,5,107.5
1/29/2018 7:00,2018,1,29,7,86.87
1/29/2018 8:00,2018,1,29,8,75.72
1/29/2018 9:00,2018,1,29,9,69.58
1/29/2018 10:00,2018,1,29,10,63.73
1/29/2018 11:00,2018,1,29,11,58.1
1/29/2018 12:00,2018,1,29,12,56.94
1/29/2018 13:00,2018,1,29,13,62.22
1/29/2018 14:00,2018,1,29,14,79.81
1/29/2018 15:00,2018,1,29,15,100.34
1/29/2018 16:00,2018,1,29,16,111.34
1/29/2018 17:00,2018,1,29,17,115.95
1/29/2018 18:00,2018,1,29,18,115.26
1/29/2018 19:00,2018,1,29,19,110.04
1/29/2018 20:00,2018,1,29,20,106.22
1/29/2018 21:00,2018,1,29,21,100.95
1/29/2018 22:00,2018,1,29,22,93.96
1/29/2018 23:00,2018,1,29,23,87.62
1/30/2018 0:00,2018,1,30,0,82.94
1/30/2018 1:00,2018,1,30,1,82.73
1/30/2018 2:00,2018,1,30,2,84.05
1/30/2018 3:00,2018,1,30,3,90.48
1/30/2018 4:00,2018,1,30,4,104.18
1/30/2018 5:00,2018,1,30,5,104.95
1/30/2018 6:00,2018,1,30,6,93.04
1/30/2018 7:00,2018,1,30,7,78.6
1/30/2018 8:00,2018,1,30,8,65.88
1/30/2018 9:00,2018,1,30,9,60.66
1/30/2018 10:00,2018,1,30,10,60.08
1/30/2018 11:00,2018,1,30,11,58.71
1/30/2018 12:00,2018,1,30,12,57.83
1/30/2018 13:00,2018,1,30,13,56.73
1/30/2018 14:00,2018,1,30,14,67.15
1/30/2018 15:00,2018,1,30,15,80.76
1/30/2018 16:00,2018,1,30,16,90.44
1/30/2018 17:00,2018,1,30,17,95.98
1/30/2018 18:00,2018,1,30,18,92.22
1/30/2018 19:00,2018,1,30,19,89.8
1/30/2018 20:00,2018,1,30,20,78.68
1/30/2018 21:00,2018,1,30,21,73.75
1/30/2018 22:00,2018,1,30,22,72.62
1/30/2018 23:00,2018,1,30,23,69.09
1/31/2018 0:00,2018,1,31,0,70.18
1/31/2018 1:00,2018,1,31,1,72.87
1/31/2018 2:00,2018,1,31,2,80.37
1/31/2018 3:00,2018,1,31,3,93.5
1/31/2018 4:00,2018,1,31,4,105.19
1/31/2018 5:00,2018,1,31,5,103.81
1/31/2018 7:00,2018,1,31,7,77.51
1/31/2018 8:00,2018,1,31,8,62.46
1/31/2018 9:00,2018,1,31,9,58.78
1/31/2018 10:00,2018,1,31,10,54.94
1/31/2018 14:00,2018,1,31,14,58.82
1/31/2018 15:00,2018,1,31,15,77.55
1/31/2018 16:00,2018,1,31,16,88.21
1/31/2018 17:00,2018,1,31,17,96.43
1/31/2018 18:00,2018,1,31,18,99.38
1/31/2018 19:00,2018,1,31,19,98.8
1/31/2018 20:00,2018,1,31,20,88.91
1/31/2018 21:00,2018,1,31,21,82.94
1/31/2018 22:00,2018,1,31,22,79.62
1/31/2018 23:00,2018,1,31,23,77.62
2/1/2018 0:00,2018,2,1,0,78.03
2/1/2018 1:00,2018,2,1,1,80.21
2/1/2018 2:00,2018,2,1,2,89.56
2/1/2018 3:00,2018,2,1,3,97.93
2/1/2018 4:00,2018,2,1,4,107.89
2/1/2018 5:00,2018,2,1,5,114.7
2/1/2018 6:00,2018,2,1,6,107.39
2/1/2018 7:00,2018,2,1,7,89.97
2/1/2018 8:00,2018,2,1,8,76.34
2/1/2018 9:00,2018,2,1,9,68.52
2/1/2018 10:00,2018,2,1,10,60.74
2/1/2018 11:00,2018,2,1,11,55.77
2/1/2018 12:00,2018,2,1,12,57.81
2/1/2018 13:00,2018,2,1,13,63.79
2/1/2018 14:00,2018,2,1,14,68.71
2/1/2018 15:00,2018,2,1,15,84.7
2/1/2018 16:00,2018,2,1,16,92.63
2/1/2018 17:00,2018,2,1,17,97.19
2/1/2018 18:00,2018,2,1,18,97.36
2/1/2018 19:00,2018,2,1,19,100.57
2/1/2018 20:00,2018,2,1,20,91.29
2/1/2018 22:00,2018,2,1,22,77.59
2/1/2018 23:00,2018,2,1,23,73.04
2/2/2018 0:00,2018,2,2,0,74.68
2/2/2018 1:00,2018,2,2,1,76.89
2/2/2018 2:00,2018,2,2,2,79.35
2/2/2018 3:00,2018,2,2,3,94.26
2/2/2018 4:00,2018,2,2,4,106.38
2/2/2018 5:00,2018,2,2,5,111.5
2/2/2018 6:00,2018,2,2,6,99.85
2/2/2018 7:00,2018,2,2,7,82.14
2/2/2018 8:00,2018,2,2,8,66.84
2/2/2018 9:00,2018,2,2,9,61.93
2/2/2018 10:00,2018,2,2,10,57.95
2/2/2018 11:00,2018,2,2,11,55.39
2/2/2018 12:00,2018,2,2,12,53.74
2/2/2018 13:00,2018,2,2,13,56.44
2/2/2018 14:00,2018,2,2,14,70.33
2/2/2018 15:00,2018,2,2,15,84.93
2/2/2018 16:00,2018,2,2,16,91.28
2/2/2018 17:00,2018,2,2,17,96.55
2/2/2018 18:00,2018,2,2,18,98.94
2/2/2018 19:00,2018,2,2,19,96.17
2/2/2018 20:00,2018,2,2,20,85.49
2/2/2018 21:00,2018,2,2,21,81.65
2/2/2018 22:00,2018,2,2,22,76.7
2/2/2018 23:00,2018,2,2,23,74.84
2/3/2018 0:00,2018,2,3,0,72.49
2/3/2018 1:00,2018,2,3,1,71.85
2/3/2018 2:00,2018,2,3,2,77.83
2/3/2018 3:00,2018,2,3,3,82.63
2/3/2018 4:00,2018,2,3,4,99.42
2/3/2018 5:00,2018,2,3,5,100.91
2/3/2018 6:00,2018,2,3,6,91.68
2/3/2018 11:00,2018,2,3,11,59.89
2/3/2018 21:00,2018,2,3,21,78.77
2/3/2018 22:00,2018,2,3,22,80.62
2/3/2018 23:00,2018,2,3,23,74.56
2/4/2018 0:00,2018,2,4,0,70.22
2/4/2018 1:00,2018,2,4,1,71.12
2/4/2018 2:00,2018,2,4,2,73.56
2/4/2018 3:00,2018,2,4,3,80.43
2/4/2018 4:00,2018,2,4,4,83.85
2/4/2018 5:00,2018,2,4,5,86.4
2/4/2018 6:00,2018,2,4,6,82.03
2/4/2018 7:00,2018,2,4,7,71.94
2/4/2018 8:00,2018,2,4,8,61.62
2/4/2018 9:00,2018,2,4,9,58.18
2/4/2018 10:00,2018,2,4,10,55.34
2/4/2018 11:00,2018,2,4,11,48.3
2/4/2018 12:00,2018,2,4,12,46.92
2/4/2018 14:00,2018,2,4,14,57.09
2/4/2018 15:00,2018,2,4,15,72.91
2/4/2018 16:00,2018,2,4,16,83.25
2/4/2018 17:00,2018,2,4,17,86.29
2/4/2018 18:00,2018,2,4,18,85.02
2/4/2018 19:00,2018,2,4,19,85.87
2/4/2018 20:00,2018,2,4,20,74.24
2/4/2018 21:00,2018,2,4,21,69.19
2/4/2018 22:00,2018,2,4,22,65.37
2/4/2018 23:00,2018,2,4,23,61.64
2/5/2018 1:00,2018,2,5,1,63.66
2/5/2018 2:00,2018,2,5,2,67.45
2/5/2018 3:00,2018,2,5,3,79.17
2/5/2018 4:00,2018,2,5,4,88.5
2/5/2018 5:00,2018,2,5,5,96.52
2/5/2018 6:00,2018,2,5,6,93.79
2/5/2018 7:00,2018,2,5,7,82.08
2/5/2018 8:00,2018,2,5,8,72.81
2/5/2018 9:00,2018,2,5,9,58.19
2/5/2018 10:00,2018,2,5,10,53.68
2/5/2018 11:00,2018,2,5,11,55.74
2/5/2018 12:00,2018,2,5,12,53.43
2/5/2018 13:00,2018,2,5,13,61.31
2/5/2018 14:00,2018,2,5,14,66.06
2/5/2018 15:00,2018,2,5,15,75.05
2/5/2018 16:00,2018,2,5,16,87.31
2/5/2018 17:00,2018,2,5,17,91.84
2/5/2018 18:00,2018,2,5,18,91.23
2/5/2018 19:00,2018,2,5,19,88.04
2/5/2018 20:00,2018,2,5,20,78.92
2/5/2018 21:00,2018,2,5,21,76.19
2/5/2018 22:00,2018,2,5,22,72.09
2/5/2018 23:00,2018,2,5,23,70.43
2/6/2018 0:00,2018,2,6,0,69.13
2/6/2018 1:00,2018,2,6,1,72.8
2/6/2018 2:00,2018,2,6,2,72.15
2/6/2018 3:00,2018,2,6,3,78.18
2/6/2018 4:00,2018,2,6,4,86.68
2/6/2018 5:00,2018,2,6,5,99.37
2/6/2018 6:00,2018,2,6,6,87.82
2/6/2018 7:00,2018,2,6,7,76.05
2/6/2018 8:00,2018,2,6,8,69.68
2/6/2018 9:00,2018,2,6,9,67.38
2/6/2018 10:00,2018,2,6,10,60.65
2/6/2018 11:00,2018,2,6,11,55.3
2/6/2018 12:00,2018,2,6,12,56.74
2/6/2018 13:00,2018,2,6,13,60.44
2/6/2018 14:00,2018,2,6,14,68.59
2/6/2018 15:00,2018,2,6,15,73.9
2/6/2018 16:00,2018,2,6,16,82.28
2/6/2018 17:00,2018,2,6,17,83.42
2/6/2018 18:00,2018,2,6,18,84.23
2/6/2018 19:00,2018,2,6,19,79.87
2/6/2018 20:00,2018,2,6,20,75.24
2/6/2018 21:00,2018,2,6,21,71.49
2/6/2018 22:00,2018,2,6,22,66.21
2/6/2018 23:00,2018,2,6,23,64.2
2/7/2018 1:00,2018,2,7,1,61.68
2/7/2018 2:00,2018,2,7,2,67.02
2/7/2018 3:00,2018,2,7,3,78.9
2/7/2018 4:00,2018,2,7,4,81.18
2/7/2018 5:00,2018,2,7,5,87.41
2/7/2018 6:00,2018,2,7,6,86.42
2/7/2018 7:00,2018,2,7,7,69.06
2/7/2018 8:00,2018,2,7,8,66.77
2/7/2018 9:00,2018,2,7,9,59.54
2/7/2018 10:00,2018,2,7,10,51.26
2/7/2018 14:00,2018,2,7,14,64.4
2/7/2018 15:00,2018,2,7,15,70.66
2/7/2018 16:00,2018,2,7,16,75.58
2/7/2018 18:00,2018,2,7,18,79.45
2/7/2018 19:00,2018,2,7,19,80.84
2/7/2018 20:00,2018,2,7,20,72.96
2/7/2018 21:00,2018,2,7,21,68.58
2/7/2018 22:00,2018,2,7,22,65.96
2/7/2018 23:00,2018,2,7,23,61.71
2/8/2018 0:00,2018,2,8,0,63.06
2/8/2018 1:00,2018,2,8,1,66.48
2/8/2018 2:00,2018,2,8,2,71.68
2/8/2018 3:00,2018,2,8,3,84.23
2/8/2018 4:00,2018,2,8,4,89.33
2/8/2018 5:00,2018,2,8,5,96.57
2/8/2018 6:00,2018,2,8,6,83.62
2/8/2018 10:00,2018,2,8,10,48.79
2/8/2018 11:00,2018,2,8,11,48.78
2/8/2018 12:00,2018,2,8,12,43.51
2/8/2018 13:00,2018,2,8,13,44.04
2/8/2018 14:00,2018,2,8,14,58.52
2/8/2018 15:00,2018,2,8,15,67.72
2/8/2018 16:00,2018,2,8,16,80.1
2/8/2018 17:00,2018,2,8,17,90.03
2/8/2018 18:00,2018,2,8,18,85.32
2/8/2018 19:00,2018,2,8,19,85.7
2/8/2018 20:00,2018,2,8,20,70.61
2/8/2018 21:00,2018,2,8,21,66.67
2/8/2018 22:00,2018,2,8,22,62.59
2/8/2018 23:00,2018,2,8,23,61.69
2/9/2018 0:00,2018,2,9,0,62.75
2/9/2018 1:00,2018,2,9,1,66.45
2/9/2018 2:00,2018,2,9,2,70.77
2/9/2018 3:00,2018,2,9,3,81.05
2/9/2018 4:00,2018,2,9,4,90.28
2/9/2018 5:00,2018,2,9,5,87.81
2/9/2018 6:00,2018,2,9,6,80.1
2/9/2018 7:00,2018,2,9,7,71.15
2/9/2018 8:00,2018,2,9,8,56.83
2/9/2018 9:00,2018,2,9,9,49.9
2/9/2018 10:00,2018,2,9,10,42.25
2/9/2018 11:00,2018,2,9,11,38.54
2/9/2018 12:00,2018,2,9,12,41.14
2/9/2018 13:00,2018,2,9,13,47.05
2/9/2018 14:00,2018,2,9,14,58.16
2/9/2018 15:00,2018,2,9,15,71.82
2/9/2018 16:00,2018,2,9,16,97.26
2/9/2018 17:00,2018,2,9,17,95.03
2/9/2018 18:00,2018,2,9,18,96.88
2/9/2018 19:00,2018,2,9,19,89.47
2/9/2018 20:00,2018,2,9,20,85.53
2/9/2018 21:00,2018,2,9,21,85.03
2/9/2018 22:00,2018,2,9,22,73.07
2/9/2018 23:00,2018,2,9,23,70.02
2/10/2018 0:00,2018,2,10,0,68.52
2/10/2018 1:00,2018,2,10,1,78.39
2/10/2018 2:00,2018,2,10,2,80.65
2/10/2018 3:00,2018,2,10,3,89.01
2/10/2018 4:00,2018,2,10,4,102.14
2/10/2018 5:00,2018,2,10,5,94.71
2/10/2018 6:00,2018,2,10,6,93.91
2/10/2018 7:00,2018,2,10,7,77.52
2/10/2018 8:00,2018,2,10,8,65.04
2/10/2018 9:00,2018,2,10,9,56.16
2/10/2018 10:00,2018,2,10,10,49.71
2/10/2018 11:00,2018,2,10,11,49.34
2/10/2018 12:00,2018,2,10,12,49.84
2/10/2018 13:00,2018,2,10,13,52.01
2/10/2018 14:00,2018,2,10,14,62.3
2/10/2018 15:00,2018,2,10,15,70.38
2/10/2018 16:00,2018,2,10,16,87.17
2/10/2018 17:00,2018,2,10,17,94.25
2/10/2018 18:00,2018,2,10,18,93.58
2/10/2018 19:00,2018,2,10,19,91.07
2/10/2018 20:00,2018,2,10,20,80.2
2/10/2018 21:00,2018,2,10,21,81.68
2/10/2018 22:00,2018,2,10,22,76.13
2/10/2018 23:00,2018,2,10,23,71.13
2/11/2018 0:00,2018,2,11,0,68.05
2/11/2018 1:00,2018,2,11,1,66.32
2/11/2018 2:00,2018,2,11,2,68.55
2/11/2018 3:00,2018,2,11,3,75.79
2/11/2018 4:00,2018,2,11,4,83.8
2/11/2018 5:00,2018,2,11,5,84.12
2/11/2018 6:00,2018,2,11,6,81.52
2/11/2018 7:00,2018,2,11,7,71.07
2/11/2018 10:00,2018,2,11,10,55.67
2/11/2018 11:00,2018,2,11,11,51.25
2/11/2018 15:00,2018,2,11,15,60.99
2/11/2018 16:00,2018,2,11,16,66.26
2/11/2018 17:00,2018,2,11,17,68.71
2/11/2018 18:00,2018,2,11,18,69.99
2/11/2018 19:00,2018,2,11,19,70.19
2/11/2018 20:00,2018,2,11,20,66.86
2/11/2018 21:00,2018,2,11,21,61.5
2/11/2018 22:00,2018,2,11,22,61.4
2/11/2018 23:00,2018,2,11,23,62.53
2/12/2018 0:00,2018,2,12,0,60.45
2/12/2018 4:00,2018,2,12,4,71.59
2/12/2018 5:00,2018,2,12,5,75.01
2/12/2018 6:00,2018,2,12,6,69.21
2/12/2018 7:00,2018,2,12,7,65.94
2/12/2018 8:00,2018,2,12,8,60.06
2/12/2018 9:00,2018,2,12,9,58.93
2/12/2018 10:00,2018,2,12,10,58.38
2/12/2018 11:00,2018,2,12,11,52.4
2/12/2018 12:00,2018,2,12,12,50
2/12/2018 13:00,2018,2,12,13,49.61
2/12/2018 14:00,2018,2,12,14,54.04
2/12/2018 15:00,2018,2,12,15,61.49
2/12/2018 16:00,2018,2,12,16,67.08
2/12/2018 17:00,2018,2,12,17,67.99
2/12/2018 18:00,2018,2,12,18,68.97
2/12/2018 19:00,2018,2,12,19,67.76
2/12/2018 20:00,2018,2,12,20,61.58
2/12/2018 22:00,2018,2,12,22,53.8
2/12/2018 23:00,2018,2,12,23,52.27
2/13/2018 0:00,2018,2,13,0,52.73
2/13/2018 1:00,2018,2,13,1,53.5
2/13/2018 2:00,2018,2,13,2,58.58
2/13/2018 3:00,2018,2,13,3,65.57
2/13/2018 4:00,2018,2,13,4,71.2
2/13/2018 5:00,2018,2,13,5,70.69
2/13/2018 6:00,2018,2,13,6,67.22
2/13/2018 7:00,2018,2,13,7,64.76
2/13/2018 8:00,2018,2,13,8,63.2
2/13/2018 9:00,2018,2,13,9,57.46
2/13/2018 10:00,2018,2,13,10,51.09
2/13/2018 11:00,2018,2,13,11,48.73
2/13/2018 12:00,2018,2,13,12,47.15
2/13/2018 13:00,2018,2,13,13,52.22
2/13/2018 14:00,2018,2,13,14,58.53
2/13/2018 15:00,2018,2,13,15,66.29
2/13/2018 16:00,2018,2,13,16,68.65
2/13/2018 17:00,2018,2,13,17,70.61
2/13/2018 18:00,2018,2,13,18,71.69
2/13/2018 19:00,2018,2,13,19,70.58
2/13/2018 20:00,2018,2,13,20,69.13
2/13/2018 21:00,2018,2,13,21,66.19
2/13/2018 22:00,2018,2,13,22,62.77
2/13/2018 23:00,2018,2,13,23,53.5
2/14/2018 0:00,2018,2,14,0,57.03
2/14/2018 1:00,2018,2,14,1,53.41
2/14/2018 2:00,2018,2,14,2,56.18
2/14/2018 3:00,2018,2,14,3,62.82
2/14/2018 4:00,2018,2,14,4,66.09
2/14/2018 8:00,2018,2,14,8,43.98
2/14/2018 9:00,2018,2,14,9,40.62
2/14/2018 10:00,2018,2,14,10,36.89
2/14/2018 11:00,2018,2,14,11,36.34
2/14/2018 12:00,2018,2,14,12,39.12
2/14/2018 13:00,2018,2,14,13,40.41
2/14/2018 14:00,2018,2,14,14,44.21
2/14/2018 15:00,2018,2,14,15,52.52
2/14/2018 16:00,2018,2,14,16,58.72
2/14/2018 19:00,2018,2,14,19,66.07
2/14/2018 20:00,2018,2,14,20,58.28
2/14/2018 21:00,2018,2,14,21,58.26
2/14/2018 22:00,2018,2,14,22,54.47
2/14/2018 23:00,2018,2,14,23,54.02
2/15/2018 0:00,2018,2,15,0,50.54
2/15/2018 1:00,2018,2,15,1,51.32
2/15/2018 2:00,2018,2,15,2,55.69
2/15/2018 3:00,2018,2,15,3,60.71
2/15/2018 4:00,2018,2,15,4,64.65
2/15/2018 5:00,2018,2,15,5,61.7
2/15/2018 6:00,2018,2,15,6,55.66
2/15/2018 7:00,2018,2,15,7,51.08
2/15/2018 8:00,2018,2,15,8,47.51
2/15/2018 9:00,2018,2,15,9,44.25
2/15/2018 10:00,2018,2,15,10,41.3
2/15/2018 11:00,2018,2,15,11,40.69
2/15/2018 12:00,2018,2,15,12,41.15
2/15/2018 13:00,2018,2,15,13,42.72
2/15/2018 14:00,2018,2,15,14,51.5
2/15/2018 15:00,2018,2,15,15,62.07
2/15/2018 16:00,2018,2,15,16,73.52
2/15/2018 17:00,2018,2,15,17,77.4
2/15/2018 18:00,2018,2,15,18,85.16
2/15/2018 19:00,2018,2,15,19,87.49
2/15/2018 20:00,2018,2,15,20,82.21
2/15/2018 21:00,2018,2,15,21,75.86
2/15/2018 22:00,2018,2,15,22,74.66
2/15/2018 23:00,2018,2,15,23,69.5
2/16/2018 0:00,2018,2,16,0,68.42
2/16/2018 1:00,2018,2,16,1,73
2/16/2018 2:00,2018,2,16,2,82.27
2/16/2018 3:00,2018,2,16,3,93.59
2/16/2018 4:00,2018,2,16,4,98.84
2/16/2018 5:00,2018,2,16,5,93.43
2/16/2018 6:00,2018,2,16,6,79.38
2/16/2018 7:00,2018,2,16,7,64.62
2/16/2018 8:00,2018,2,16,8,55.65
2/16/2018 9:00,2018,2,16,9,51.28
2/16/2018 10:00,2018,2,16,10,45.75
2/16/2018 11:00,2018,2,16,11,41.88
2/16/2018 12:00,2018,2,16,12,41.31
2/16/2018 13:00,2018,2,16,13,48.55
2/16/2018 14:00,2018,2,16,14,54.02
2/16/2018 15:00,2018,2,16,15,63.07
2/16/2018 16:00,2018,2,16,16,75.38
2/16/2018 17:00,2018,2,16,17,81.02
2/16/2018 18:00,2018,2,16,18,81.23
2/16/2018 19:00,2018,2,16,19,82.15
2/16/2018 20:00,2018,2,16,20,77.6
2/16/2018 21:00,2018,2,16,21,73.76
2/16/2018 22:00,2018,2,16,22,71.79
2/16/2018 23:00,2018,2,16,23,72.47
2/17/2018 0:00,2018,2,17,0,71.33
2/17/2018 1:00,2018,2,17,1,73.38
2/17/2018 2:00,2018,2,17,2,74.01
2/17/2018 3:00,2018,2,17,3,85.56
2/17/2018 4:00,2018,2,17,4,89.98
2/17/2018 5:00,2018,2,17,5,89.24
2/17/2018 6:00,2018,2,17,6,80
2/17/2018 7:00,2018,2,17,7,67.52
2/17/2018 8:00,2018,2,17,8,60.5
2/17/2018 9:00,2018,2,17,9,55.58
2/17/2018 10:00,2018,2,17,10,51.76
2/17/2018 11:00,2018,2,17,11,47.71
2/17/2018 13:00,2018,2,17,13,51.95
2/17/2018 14:00,2018,2,17,14,65.78
2/17/2018 15:00,2018,2,17,15,73.85
2/17/2018 16:00,2018,2,17,16,88
2/17/2018 18:00,2018,2,17,18,87.64
2/17/2018 19:00,2018,2,17,19,85.55
2/17/2018 20:00,2018,2,17,20,82.87
2/17/2018 21:00,2018,2,17,21,84.25
2/17/2018 22:00,2018,2,17,22,78.97
2/17/2018 23:00,2018,2,17,23,76.26
2/18/2018 0:00,2018,2,18,0,82.7
2/18/2018 1:00,2018,2,18,1,86.61
2/18/2018 2:00,2018,2,18,2,86.41
2/18/2018 3:00,2018,2,18,3,99.52
2/18/2018 4:00,2018,2,18,4,102.85
2/18/2018 5:00,2018,2,18,5,113.87
2/18/2018 6:00,2018,2,18,6,100.11
2/18/2018 7:00,2018,2,18,7,85.09
2/18/2018 8:00,2018,2,18,8,62.34
2/18/2018 10:00,2018,2,18,10,61.19
2/18/2018 11:00,2018,2,18,11,56.38
2/18/2018 12:00,2018,2,18,12,55.45
2/18/2018 13:00,2018,2,18,13,56.72
2/18/2018 14:00,2018,2,18,14,63.61
2/18/2018 15:00,2018,2,18,15,78.59
2/18/2018 16:00,2018,2,18,16,93.37
2/18/2018 17:00,2018,2,18,17,95.5
2/18/2018 18:00,2018,2,18,18,92.92
2/18/2018 19:00,2018,2,18,19,101
2/18/2018 20:00,2018,2,18,20,97.35
2/18/2018 21:00,2018,2,18,21,93.84
2/18/2018 22:00,2018,2,18,22,92.02
2/18/2018 23:00,2018,2,18,23,91.7
2/19/2018 0:00,2018,2,19,0,92.97
2/19/2018 1:00,2018,2,19,1,90.65
2/19/2018 2:00,2018,2,19,2,98.5
2/19/2018 3:00,2018,2,19,3,108.63
2/19/2018 4:00,2018,2,19,4,107.84
2/19/2018 5:00,2018,2,19,5,106.75
2/19/2018 8:00,2018,2,19,8,74.07
2/19/2018 9:00,2018,2,19,9,65.18
2/19/2018 10:00,2018,2,19,10,68.45
2/19/2018 11:00,2018,2,19,11,64.91
2/19/2018 12:00,2018,2,19,12,65.76
2/19/2018 13:00,2018,2,19,13,65.22
2/19/2018 14:00,2018,2,19,14,63.46
2/19/2018 15:00,2018,2,19,15,82.87
2/19/2018 16:00,2018,2,19,16,96.52
2/19/2018 17:00,2018,2,19,17,104.09
2/19/2018 18:00,2018,2,19,18,101.15
2/19/2018 19:00,2018,2,19,19,100.43
2/19/2018 20:00,2018,2,19,20,90.4
2/19/2018 21:00,2018,2,19,21,85.94
2/19/2018 22:00,2018,2,19,22,74.83
2/19/2018 23:00,2018,2,19,23,74.02
2/20/2018 0:00,2018,2,20,0,73.89
2/20/2018 1:00,2018,2,20,1,80.65
2/20/2018 2:00,2018,2,20,2,83.36
2/20/2018 3:00,2018,2,20,3,100.4
2/20/2018 4:00,2018,2,20,4,98.57
2/20/2018 5:00,2018,2,20,5,98.52
2/20/2018 6:00,2018,2,20,6,91.12
2/20/2018 7:00,2018,2,20,7,77.61
2/20/2018 8:00,2018,2,20,8,67.64
2/20/2018 9:00,2018,2,20,9,60.1
2/20/2018 10:00,2018,2,20,10,55.33
2/20/2018 11:00,2018,2,20,11,50.11
2/20/2018 12:00,2018,2,20,12,49.98
2/20/2018 13:00,2018,2,20,13,55
2/20/2018 14:00,2018,2,20,14,64.42
2/20/2018 15:00,2018,2,20,15,79.94
2/20/2018 16:00,2018,2,20,16,93.61
2/20/2018 17:00,2018,2,20,17,101.36
2/20/2018 18:00,2018,2,20,18,105.31
2/20/2018 19:00,2018,2,20,19,108.34
2/20/2018 20:00,2018,2,20,20,99.6
2/20/2018 21:00,2018,2,20,21,93.83
2/20/2018 22:00,2018,2,20,22,88.97
2/20/2018 23:00,2018,2,20,23,84.93
2/21/2018 0:00,2018,2,21,0,81.79
2/21/2018 1:00,2018,2,21,1,80.94
2/21/2018 2:00,2018,2,21,2,83.06
2/21/2018 3:00,2018,2,21,3,89.49
2/21/2018 4:00,2018,2,21,4,106.57
2/21/2018 5:00,2018,2,21,5,102.62
2/21/2018 6:00,2018,2,21,6,85.22
2/21/2018 7:00,2018,2,21,7,72.41
2/21/2018 8:00,2018,2,21,8,64.04
2/21/2018 9:00,2018,2,21,9,56.6
2/21/2018 10:00,2018,2,21,10,53.72
2/21/2018 11:00,2018,2,21,11,53.23
2/21/2018 12:00,2018,2,21,12,54.04
2/21/2018 13:00,2018,2,21,13,56.34
2/21/2018 14:00,2018,2,21,14,64.24
2/21/2018 15:00,2018,2,21,15,85.97
2/21/2018 16:00,2018,2,21,16,91.88
2/21/2018 17:00,2018,2,21,17,97.37
2/21/2018 18:00,2018,2,21,18,101.63
2/21/2018 19:00,2018,2,21,19,102.16
2/21/2018 20:00,2018,2,21,20,90.8
2/21/2018 21:00,2018,2,21,21,87.35
2/21/2018 23:00,2018,2,21,23,76.34
2/22/2018 0:00,2018,2,22,0,76.39
2/22/2018 1:00,2018,2,22,1,80.68
2/22/2018 3:00,2018,2,22,3,99
2/22/2018 4:00,2018,2,22,4,99.91
2/22/2018 5:00,2018,2,22,5,99.21
2/22/2018 6:00,2018,2,22,6,91.05
2/22/2018 7:00,2018,2,22,7,80.37
2/22/2018 8:00,2018,2,22,8,70.97
2/22/2018 9:00,2018,2,22,9,60.94
2/22/2018 10:00,2018,2,22,10,57.68
2/22/2018 11:00,2018,2,22,11,53.01
2/22/2018 12:00,2018,2,22,12,52.33
2/22/2018 13:00,2018,2,22,13,53.98
2/22/2018 14:00,2018,2,22,14,65.16
2/22/2018 15:00,2018,2,22,15,82.09
2/22/2018 16:00,2018,2,22,16,91.96
2/22/2018 17:00,2018,2,22,17,93.87
2/22/2018 18:00,2018,2,22,18,94.1
2/22/2018 19:00,2018,2,22,19,92.85
2/22/2018 20:00,2018,2,22,20,85.21
2/22/2018 21:00,2018,2,22,21,82.9
2/22/2018 22:00,2018,2,22,22,78.52
2/22/2018 23:00,2018,2,22,23,81.13
2/23/2018 0:00,2018,2,23,0,82.91
2/23/2018 1:00,2018,2,23,1,82.62
2/23/2018 2:00,2018,2,23,2,87.21
2/23/2018 3:00,2018,2,23,3,99.26
2/23/2018 4:00,2018,2,23,4,96.67
2/23/2018 5:00,2018,2,23,5,102.06
2/23/2018 6:00,2018,2,23,6,93.52
2/23/2018 7:00,2018,2,23,7,73.94
2/23/2018 8:00,2018,2,23,8,68.12
2/23/2018 9:00,2018,2,23,9,62.75
2/23/2018 10:00,2018,2,23,10,56.93
2/23/2018 11:00,2018,2,23,11,53.21
2/23/2018 12:00,2018,2,23,12,54.44
2/23/2018 13:00,2018,2,23,13,54.14
2/23/2018 14:00,2018,2,23,14,54.91
2/23/2018 15:00,2018,2,23,15,56.43
2/26/2018 16:00,2018,2,26,16,69.89
2/26/2018 17:00,2018,2,26,17,70.02
2/26/2018 18:00,2018,2,26,18,74.04
2/26/2018 20:00,2018,2,26,20,70.8
2/26/2018 21:00,2018,2,26,21,62.84
2/26/2018 22:00,2018,2,26,22,58.98
2/26/2018 23:00,2018,2,26,23,59.43
2/27/2018 0:00,2018,2,27,0,62.82
2/27/2018 1:00,2018,2,27,1,60.34
2/27/2018 2:00,2018,2,27,2,69.63
2/27/2018 3:00,2018,2,27,3,80.33
2/27/2018 4:00,2018,2,27,4,80.3
2/27/2018 5:00,2018,2,27,5,79.88
2/27/2018 6:00,2018,2,27,6,63.48
2/27/2018 7:00,2018,2,27,7,63.3
2/27/2018 8:00,2018,2,27,8,46.92
2/27/2018 9:00,2018,2,27,9,43.94
2/27/2018 10:00,2018,2,27,10,40.32
2/27/2018 11:00,2018,2,27,11,40.25
2/27/2018 12:00,2018,2,27,12,40.22
2/27/2018 13:00,2018,2,27,13,41.01
2/27/2018 14:00,2018,2,27,14,56.13
2/27/2018 15:00,2018,2,27,15,65.38
2/27/2018 16:00,2018,2,27,16,74.21
2/27/2018 17:00,2018,2,27,17,75.12
2/27/2018 18:00,2018,2,27,18,78.39
2/27/2018 19:00,2018,2,27,19,73.81
2/27/2018 22:00,2018,2,27,22,71.29
2/27/2018 23:00,2018,2,27,23,68.63
2/28/2018 0:00,2018,2,28,0,60.45
2/28/2018 1:00,2018,2,28,1,62.56
2/28/2018 2:00,2018,2,28,2,73.6
2/28/2018 3:00,2018,2,28,3,87.67
2/28/2018 4:00,2018,2,28,4,90.36
2/28/2018 5:00,2018,2,28,5,79.62
2/28/2018 6:00,2018,2,28,6,78.02
2/28/2018 7:00,2018,2,28,7,64.6
2/28/2018 8:00,2018,2,28,8,51.23
2/28/2018 9:00,2018,2,28,9,50.1
2/28/2018 10:00,2018,2,28,10,46.69
2/28/2018 11:00,2018,2,28,11,43.14
2/28/2018 12:00,2018,2,28,12,41.9
2/28/2018 13:00,2018,2,28,13,45.86
2/28/2018 14:00,2018,2,28,14,63.27
2/28/2018 15:00,2018,2,28,15,73.17
2/28/2018 16:00,2018,2,28,16,88.44
2/28/2018 17:00,2018,2,28,17,83.32
2/28/2018 18:00,2018,2,28,18,82.65
2/28/2018 19:00,2018,2,28,19,82.14
2/28/2018 20:00,2018,2,28,20,73.41
2/28/2018 21:00,2018,2,28,21,71.21
2/28/2018 22:00,2018,2,28,22,64.85
2/28/2018 23:00,2018,2,28,23,65.59
3/1/2018 0:00,2018,3,1,0,62.84
3/1/2018 1:00,2018,3,1,1,65.6
3/1/2018 2:00,2018,3,1,2,68.07
3/1/2018 3:00,2018,3,1,3,75.87
3/1/2018 4:00,2018,3,1,4,86.54
3/1/2018 5:00,2018,3,1,5,77.15
3/1/2018 6:00,2018,3,1,6,76.86
3/1/2018 7:00,2018,3,1,7,57.53
3/1/2018 8:00,2018,3,1,8,52.82
3/1/2018 9:00,2018,3,1,9,48.13
3/1/2018 10:00,2018,3,1,10,43.29
3/1/2018 11:00,2018,3,1,11,41.34
3/1/2018 12:00,2018,3,1,12,42.91
3/1/2018 13:00,2018,3,1,13,48.49
3/1/2018 14:00,2018,3,1,14,57.37
3/1/2018 15:00,2018,3,1,15,64.05
3/1/2018 16:00,2018,3,1,16,79.91
3/1/2018 17:00,2018,3,1,17,96.11
3/1/2018 18:00,2018,3,1,18,97.99
3/1/2018 19:00,2018,3,1,19,95.02
3/1/2018 20:00,2018,3,1,20,91.96
3/1/2018 21:00,2018,3,1,21,87.12
3/1/2018 22:00,2018,3,1,22,92.84
3/1/2018 23:00,2018,3,1,23,82.32
3/2/2018 0:00,2018,3,2,0,79.59
3/2/2018 1:00,2018,3,2,1,77.87
3/2/2018 2:00,2018,3,2,2,83.46
3/2/2018 3:00,2018,3,2,3,87.23
3/2/2018 4:00,2018,3,2,4,98.41
3/2/2018 5:00,2018,3,2,5,82.88
3/2/2018 6:00,2018,3,2,6,68.79
3/2/2018 7:00,2018,3,2,7,57.02
3/2/2018 8:00,2018,3,2,8,49.73
3/2/2018 9:00,2018,3,2,9,43.09
3/2/2018 10:00,2018,3,2,10,42.59
3/2/2018 11:00,2018,3,2,11,40.98
3/2/2018 12:00,2018,3,2,12,41.75
3/2/2018 13:00,2018,3,2,13,45.5
3/2/2018 14:00,2018,3,2,14,57.15
3/2/2018 15:00,2018,3,2,15,60.84
3/2/2018 16:00,2018,3,2,16,64.87
3/2/2018 17:00,2018,3,2,17,66.03
3/2/2018 18:00,2018,3,2,18,61.34
3/2/2018 19:00,2018,3,2,19,56.08
3/2/2018 20:00,2018,3,2,20,55.92
3/2/2018 21:00,2018,3,2,21,53.92
3/2/2018 22:00,2018,3,2,22,53.49
3/2/2018 23:00,2018,3,2,23,53.37
3/3/2018 0:00,2018,3,3,0,53.18
3/3/2018 1:00,2018,3,3,1,53.44
3/3/2018 2:00,2018,3,3,2,53.8
3/3/2018 3:00,2018,3,3,3,56.27
3/3/2018 4:00,2018,3,3,4,58.39
3/3/2018 5:00,2018,3,3,5,56.48
3/3/2018 6:00,2018,3,3,6,54.98
3/3/2018 7:00,2018,3,3,7,54.14
3/3/2018 8:00,2018,3,3,8,53.88
3/3/2018 9:00,2018,3,3,9,53.33
3/3/2018 10:00,2018,3,3,10,53.34
3/3/2018 11:00,2018,3,3,11,53.88
3/3/2018 12:00,2018,3,3,12,53.92
3/3/2018 15:00,2018,3,3,15,55.12
3/3/2018 16:00,2018,3,3,16,55.27
3/3/2018 17:00,2018,3,3,17,56.51
3/3/2018 18:00,2018,3,3,18,54.77
3/3/2018 19:00,2018,3,3,19,53.85
3/3/2018 20:00,2018,3,3,20,53.56
3/3/2018 21:00,2018,3,3,21,53.58
3/3/2018 22:00,2018,3,3,22,53.17
3/3/2018 23:00,2018,3,3,23,53.27
3/4/2018 0:00,2018,3,4,0,51.92
3/4/2018 1:00,2018,3,4,1,51.8
3/4/2018 2:00,2018,3,4,2,52.49
3/4/2018 3:00,2018,3,4,3,53.67
3/4/2018 4:00,2018,3,4,4,54.16
3/4/2018 5:00,2018,3,4,5,54.03
3/4/2018 6:00,2018,3,4,6,53.04
3/4/2018 8:00,2018,3,4,8,52.62
3/4/2018 9:00,2018,3,4,9,52.93
3/4/2018 10:00,2018,3,4,10,52.92
3/4/2018 11:00,2018,3,4,11,58.35
3/4/2018 12:00,2018,3,4,12,53.93
3/4/2018 13:00,2018,3,4,13,53.17
3/4/2018 14:00,2018,3,4,14,53.83
3/4/2018 15:00,2018,3,4,15,53.54
3/4/2018 16:00,2018,3,4,16,53.19
3/4/2018 17:00,2018,3,4,17,52.8
3/4/2018 18:00,2018,3,4,18,52.34
3/4/2018 19:00,2018,3,4,19,52.22
3/4/2018 20:00,2018,3,4,20,52.11
3/4/2018 21:00,2018,3,4,21,52.58
3/4/2018 22:00,2018,3,4,22,52.93
3/4/2018 23:00,2018,3,4,23,52.1
3/5/2018 0:00,2018,3,5,0,52.11
3/5/2018 1:00,2018,3,5,1,52.5
3/5/2018 2:00,2018,3,5,2,52.94
3/5/2018 3:00,2018,3,5,3,54.35
3/5/2018 4:00,2018,3,5,4,54.38
3/5/2018 5:00,2018,3,5,5,54.31
3/5/2018 6:00,2018,3,5,6,52.6
3/5/2018 7:00,2018,3,5,7,51.78
3/5/2018 8:00,2018,3,5,8,51.5
3/5/2018 9:00,2018,3,5,9,51.81
3/5/2018 10:00,2018,3,5,10,52.06
3/5/2018 11:00,2018,3,5,11,37.84
3/5/2018 12:00,2018,3,5,12,35.41
3/5/2018 13:00,2018,3,5,13,43.41
3/5/2018 14:00,2018,3,5,14,51.59
3/5/2018 15:00,2018,3,5,15,55.31
3/5/2018 16:00,2018,3,5,16,54.33
3/5/2018 17:00,2018,3,5,17,54.53
3/5/2018 18:00,2018,3,5,18,55.15
3/5/2018 19:00,2018,3,5,19,51.24
3/5/2018 20:00,2018,3,5,20,48.97
3/5/2018 21:00,2018,3,5,21,44.65
3/5/2018 22:00,2018,3,5,22,59.04
3/5/2018 23:00,2018,3,5,23,50.02
3/6/2018 0:00,2018,3,6,0,49.04
3/6/2018 1:00,2018,3,6,1,51.1
3/6/2018 2:00,2018,3,6,2,55.2
3/6/2018 3:00,2018,3,6,3,66.16
3/6/2018 4:00,2018,3,6,4,62.19
3/6/2018 5:00,2018,3,6,5,62.25
3/6/2018 6:00,2018,3,6,6,54.45
3/6/2018 7:00,2018,3,6,7,49.27
3/6/2018 8:00,2018,3,6,8,48.08
3/6/2018 9:00,2018,3,6,9,40.32
3/6/2018 10:00,2018,3,6,10,39.28
3/6/2018 11:00,2018,3,6,11,39.05
3/6/2018 12:00,2018,3,6,12,39.82
3/6/2018 13:00,2018,3,6,13,45.82
3/6/2018 14:00,2018,3,6,14,52.47
3/6/2018 15:00,2018,3,6,15,58.92
3/6/2018 16:00,2018,3,6,16,55.25
3/6/2018 17:00,2018,3,6,17,61.62
3/6/2018 18:00,2018,3,6,18,62.19
3/6/2018 19:00,2018,3,6,19,60.44
3/6/2018 20:00,2018,3,6,20,60.31
3/6/2018 21:00,2018,3,6,21,53.4
3/6/2018 22:00,2018,3,6,22,52.32
3/6/2018 23:00,2018,3,6,23,53.08
3/7/2018 0:00,2018,3,7,0,53.83
3/7/2018 1:00,2018,3,7,1,53.89
3/7/2018 2:00,2018,3,7,2,74.61
3/7/2018 6:00,2018,3,7,6,55.37
3/7/2018 7:00,2018,3,7,7,46.39
3/7/2018 8:00,2018,3,7,8,43.18
3/7/2018 10:00,2018,3,7,10,38.42
3/7/2018 11:00,2018,3,7,11,46.75
3/7/2018 12:00,2018,3,7,12,42.14
3/7/2018 13:00,2018,3,7,13,46.44
3/7/2018 14:00,2018,3,7,14,62.76
3/7/2018 15:00,2018,3,7,15,67.82
3/7/2018 16:00,2018,3,7,16,68.73
3/7/2018 17:00,2018,3,7,17,68.2
3/7/2018 18:00,2018,3,7,18,78.94
3/7/2018 19:00,2018,3,7,19,73.95
3/7/2018 20:00,2018,3,7,20,78.17
3/7/2018 21:00,2018,3,7,21,62.81
3/7/2018 22:00,2018,3,7,22,64.02
3/7/2018 23:00,2018,3,7,23,59.91
3/8/2018 0:00,2018,3,8,0,59.64
3/8/2018 1:00,2018,3,8,1,63.42
3/8/2018 2:00,2018,3,8,2,70.77
3/8/2018 3:00,2018,3,8,3,83.89
3/8/2018 4:00,2018,3,8,4,84.56
3/8/2018 5:00,2018,3,8,5,72.71
3/8/2018 6:00,2018,3,8,6,61.12
3/8/2018 7:00,2018,3,8,7,52.38
3/8/2018 8:00,2018,3,8,8,50.61
3/8/2018 9:00,2018,3,8,9,49.39
3/8/2018 10:00,2018,3,8,10,49.34
3/8/2018 11:00,2018,3,8,11,43.03
3/8/2018 13:00,2018,3,8,13,43.15
3/8/2018 14:00,2018,3,8,14,55.72
3/8/2018 15:00,2018,3,8,15,68.03
3/8/2018 16:00,2018,3,8,16,68.9
3/8/2018 17:00,2018,3,8,17,73.07
3/8/2018 19:00,2018,3,8,19,72.47
3/8/2018 20:00,2018,3,8,20,68.67
3/8/2018 21:00,2018,3,8,21,69.49
3/8/2018 22:00,2018,3,8,22,67.66
3/8/2018 23:00,2018,3,8,23,67.87
3/9/2018 0:00,2018,3,9,0,63.93
3/9/2018 1:00,2018,3,9,1,66.33
3/9/2018 2:00,2018,3,9,2,69.59
3/9/2018 3:00,2018,3,9,3,76.83
3/9/2018 4:00,2018,3,9,4,77.01
3/9/2018 5:00,2018,3,9,5,70.2
3/9/2018 6:00,2018,3,9,6,62.4
3/9/2018 7:00,2018,3,9,7,54.09
3/9/2018 8:00,2018,3,9,8,51.19
3/9/2018 9:00,2018,3,9,9,51.26
3/9/2018 10:00,2018,3,9,10,47.92
3/9/2018 11:00,2018,3,9,11,50.85
3/9/2018 12:00,2018,3,9,12,49.62
3/9/2018 13:00,2018,3,9,13,55.42
3/9/2018 14:00,2018,3,9,14,67.61
3/9/2018 15:00,2018,3,9,15,77.22
3/9/2018 16:00,2018,3,9,16,80.64
3/9/2018 17:00,2018,3,9,17,88.3
3/9/2018 18:00,2018,3,9,18,85.58
3/9/2018 19:00,2018,3,9,19,87.74
3/9/2018 20:00,2018,3,9,20,84.53
3/9/2018 21:00,2018,3,9,21,76.89
3/9/2018 22:00,2018,3,9,22,73.39
3/10/2018 0:00,2018,3,10,0,66.23
3/10/2018 1:00,2018,3,10,1,72.95
3/10/2018 5:00,2018,3,10,5,77.52
3/10/2018 10:00,2018,3,10,10,52.95
3/10/2018 11:00,2018,3,10,11,49.29
3/10/2018 12:00,2018,3,10,12,49.78
3/10/2018 13:00,2018,3,10,13,51.03
3/10/2018 14:00,2018,3,10,14,72.14
3/10/2018 15:00,2018,3,10,15,87.44
3/10/2018 16:00,2018,3,10,16,85.23
3/10/2018 17:00,2018,3,10,17,80.83
3/10/2018 22:00,2018,3,10,22,74.16
3/10/2018 23:00,2018,3,10,23,71.9
3/11/2018 0:00,2018,3,11,0,74.01
3/11/2018 1:00,2018,3,11,1,74.19
3/11/2018 2:00,2018,3,11,2,85.79
3/11/2018 3:00,2018,3,11,3,95.16
3/11/2018 4:00,2018,3,11,4,96.51
3/11/2018 5:00,2018,3,11,5,87.23
3/11/2018 6:00,2018,3,11,6,71.29
3/11/2018 7:00,2018,3,11,7,67.03
3/11/2018 8:00,2018,3,11,8,58.08
3/11/2018 9:00,2018,3,11,9,53.35
3/11/2018 10:00,2018,3,11,10,50.2
3/11/2018 11:00,2018,3,11,11,47.76
3/11/2018 12:00,2018,3,11,12,47.13
3/11/2018 13:00,2018,3,11,13,50.7
3/11/2018 14:00,2018,3,11,14,61.27
3/11/2018 15:00,2018,3,11,15,67.83
3/11/2018 16:00,2018,3,11,16,82.22
3/11/2018 17:00,2018,3,11,17,82.38
3/11/2018 18:00,2018,3,11,18,78.53
3/11/2018 19:00,2018,3,11,19,74.64
3/11/2018 20:00,2018,3,11,20,72.46
3/11/2018 21:00,2018,3,11,21,70.61
3/11/2018 22:00,2018,3,11,22,64.85
3/11/2018 23:00,2018,3,11,23,68.09
3/12/2018 0:00,2018,3,12,0,65.22
3/12/2018 1:00,2018,3,12,1,67.42
3/12/2018 2:00,2018,3,12,2,73.76
3/12/2018 3:00,2018,3,12,3,90.8
3/12/2018 4:00,2018,3,12,4,91.58
3/12/2018 5:00,2018,3,12,5,84.94
3/12/2018 6:00,2018,3,12,6,71.21
3/12/2018 7:00,2018,3,12,7,61.25
3/12/2018 8:00,2018,3,12,8,53.1
3/12/2018 9:00,2018,3,12,9,48.28
3/12/2018 10:00,2018,3,12,10,46.05
3/12/2018 11:00,2018,3,12,11,45.91
3/12/2018 12:00,2018,3,12,12,46.54
3/12/2018 13:00,2018,3,12,13,51.1
3/12/2018 14:00,2018,3,12,14,59.82
3/12/2018 15:00,2018,3,12,15,70.12
3/12/2018 16:00,2018,3,12,16,79.85
3/12/2018 17:00,2018,3,12,17,79.77
3/12/2018 18:00,2018,3,12,18,80.5
3/12/2018 19:00,2018,3,12,19,77.17
3/12/2018 20:00,2018,3,12,20,79.24
3/12/2018 21:00,2018,3,12,21,81.82
3/18/2018 22:00,2018,3,18,22,57.77
3/18/2018 23:00,2018,3,18,23,58.82
3/19/2018 0:00,2018,3,19,0,57.02
3/19/2018 1:00,2018,3,19,1,65.31
3/19/2018 2:00,2018,3,19,2,72.46
3/19/2018 3:00,2018,3,19,3,82.76
3/19/2018 4:00,2018,3,19,4,82.76
3/19/2018 5:00,2018,3,19,5,73.55
3/19/2018 6:00,2018,3,19,6,74.02
3/19/2018 7:00,2018,3,19,7,70.69
3/19/2018 8:00,2018,3,19,8,67.79
3/19/2018 9:00,2018,3,19,9,38.17
3/19/2018 12:00,2018,3,19,12,47.51
3/19/2018 13:00,2018,3,19,13,52.28
3/19/2018 14:00,2018,3,19,14,63.36
3/19/2018 15:00,2018,3,19,15,76.96
3/19/2018 16:00,2018,3,19,16,83.64
3/19/2018 17:00,2018,3,19,17,88.33
3/19/2018 18:00,2018,3,19,18,80.11
3/19/2018 19:00,2018,3,19,19,82.74
3/19/2018 20:00,2018,3,19,20,76.68
3/19/2018 21:00,2018,3,19,21,74.63
3/19/2018 22:00,2018,3,19,22,69.85
3/19/2018 23:00,2018,3,19,23,71.16
3/20/2018 0:00,2018,3,20,0,74.33
3/20/2018 1:00,2018,3,20,1,74.58
3/20/2018 2:00,2018,3,20,2,83.37
3/20/2018 3:00,2018,3,20,3,91.93
3/20/2018 4:00,2018,3,20,4,94.11
3/20/2018 5:00,2018,3,20,5,81.45
3/20/2018 6:00,2018,3,20,6,74.71
3/20/2018 7:00,2018,3,20,7,66.06
3/20/2018 8:00,2018,3,20,8,59.28
3/20/2018 9:00,2018,3,20,9,56.16
3/20/2018 10:00,2018,3,20,10,58.32
3/20/2018 11:00,2018,3,20,11,54.22
3/20/2018 12:00,2018,3,20,12,55.68
3/20/2018 13:00,2018,3,20,13,59.91
3/20/2018 14:00,2018,3,20,14,73.11
3/20/2018 15:00,2018,3,20,15,87.25
3/20/2018 16:00,2018,3,20,16,86.4
3/20/2018 17:00,2018,3,20,17,94.93
3/20/2018 18:00,2018,3,20,18,89.64
3/20/2018 19:00,2018,3,20,19,80.84
3/20/2018 20:00,2018,3,20,20,77.24
3/20/2018 22:00,2018,3,20,22,70.62
3/20/2018 23:00,2018,3,20,23,65.92
3/21/2018 0:00,2018,3,21,0,73.69
3/21/2018 1:00,2018,3,21,1,78.06
3/21/2018 2:00,2018,3,21,2,82.64
3/21/2018 3:00,2018,3,21,3,85.73
3/21/2018 4:00,2018,3,21,4,81.04
3/21/2018 5:00,2018,3,21,5,75.29
3/21/2018 6:00,2018,3,21,6,69.5
3/21/2018 7:00,2018,3,21,7,66.26
3/21/2018 8:00,2018,3,21,8,65.9
3/21/2018 9:00,2018,3,21,9,59.1
3/21/2018 10:00,2018,3,21,10,57.12
3/21/2018 11:00,2018,3,21,11,47.49
3/21/2018 12:00,2018,3,21,12,55.56
3/21/2018 13:00,2018,3,21,13,61.13
3/21/2018 14:00,2018,3,21,14,69.09
3/21/2018 15:00,2018,3,21,15,77.29
3/21/2018 16:00,2018,3,21,16,82.76
3/21/2018 17:00,2018,3,21,17,84.39
3/21/2018 18:00,2018,3,21,18,82.49
3/21/2018 19:00,2018,3,21,19,79.36
3/21/2018 20:00,2018,3,21,20,71.94
3/21/2018 21:00,2018,3,21,21,66.72
3/21/2018 22:00,2018,3,21,22,64.75
3/21/2018 23:00,2018,3,21,23,63.61
3/22/2018 0:00,2018,3,22,0,61.98
3/22/2018 1:00,2018,3,22,1,65.01
3/22/2018 2:00,2018,3,22,2,72.29
3/22/2018 3:00,2018,3,22,3,80.78
3/22/2018 4:00,2018,3,22,4,79.4
3/22/2018 5:00,2018,3,22,5,69.37
3/22/2018 6:00,2018,3,22,6,67.98
3/22/2018 7:00,2018,3,22,7,59.5
3/22/2018 8:00,2018,3,22,8,55.18
3/22/2018 9:00,2018,3,22,9,48.25
3/22/2018 10:00,2018,3,22,10,44.71
3/22/2018 11:00,2018,3,22,11,43.61
3/22/2018 12:00,2018,3,22,12,46.69
3/22/2018 13:00,2018,3,22,13,50.39
3/22/2018 14:00,2018,3,22,14,61.73
3/22/2018 15:00,2018,3,22,15,66.09
3/22/2018 16:00,2018,3,22,16,69.96
3/22/2018 17:00,2018,3,22,17,70.72
3/22/2018 18:00,2018,3,22,18,70.22
3/22/2018 19:00,2018,3,22,19,68.29
3/22/2018 20:00,2018,3,22,20,63.85
3/22/2018 21:00,2018,3,22,21,60.29
3/22/2018 22:00,2018,3,22,22,59.04
3/22/2018 23:00,2018,3,22,23,60.82
3/23/2018 0:00,2018,3,23,0,62.47
3/23/2018 1:00,2018,3,23,1,69.08
3/23/2018 2:00,2018,3,23,2,70.56
3/23/2018 3:00,2018,3,23,3,78.73
3/23/2018 4:00,2018,3,23,4,77.27
3/23/2018 5:00,2018,3,23,5,73.53
3/23/2018 6:00,2018,3,23,6,64.55
3/23/2018 7:00,2018,3,23,7,60.98
3/23/2018 8:00,2018,3,23,8,48.17
3/23/2018 9:00,2018,3,23,9,43.61
3/23/2018 10:00,2018,3,23,10,46.78
3/23/2018 11:00,2018,3,23,11,45.09
3/23/2018 12:00,2018,3,23,12,47.13
3/23/2018 13:00,2018,3,23,13,54.99
3/23/2018 14:00,2018,3,23,14,53.86
3/23/2018 15:00,2018,3,23,15,53.62
3/23/2018 16:00,2018,3,23,16,64.6
3/23/2018 17:00,2018,3,23,17,71.66
3/23/2018 18:00,2018,3,23,18,74.02
3/23/2018 19:00,2018,3,23,19,73.67
3/23/2018 20:00,2018,3,23,20,71.47
3/23/2018 21:00,2018,3,23,21,68.56
3/23/2018 22:00,2018,3,23,22,65.6
3/23/2018 23:00,2018,3,23,23,59.38
3/24/2018 0:00,2018,3,24,0,60.23
3/24/2018 1:00,2018,3,24,1,61.16
3/24/2018 2:00,2018,3,24,2,69.5
3/24/2018 3:00,2018,3,24,3,72.93
3/24/2018 4:00,2018,3,24,4,73.5
3/24/2018 5:00,2018,3,24,5,69.53
3/24/2018 6:00,2018,3,24,6,63.78
3/24/2018 7:00,2018,3,24,7,62.49
3/24/2018 8:00,2018,3,24,8,52.63
3/24/2018 9:00,2018,3,24,9,50.82
3/24/2018 10:00,2018,3,24,10,48.39
3/24/2018 11:00,2018,3,24,11,44.1
3/24/2018 12:00,2018,3,24,12,46.06
3/24/2018 13:00,2018,3,24,13,51.99
3/24/2018 14:00,2018,3,24,14,63.01
3/24/2018 15:00,2018,3,24,15,63.74
3/24/2018 16:00,2018,3,24,16,72.28
3/24/2018 17:00,2018,3,24,17,74.09
3/24/2018 18:00,2018,3,24,18,78.34
3/24/2018 19:00,2018,3,24,19,74.91
3/24/2018 20:00,2018,3,24,20,70.17
3/24/2018 21:00,2018,3,24,21,64.38
3/24/2018 22:00,2018,3,24,22,58.58
3/24/2018 23:00,2018,3,24,23,57.7
3/25/2018 0:00,2018,3,25,0,59.93
3/25/2018 1:00,2018,3,25,1,62.94
3/25/2018 2:00,2018,3,25,2,69.04
3/25/2018 3:00,2018,3,25,3,78.16
3/25/2018 4:00,2018,3,25,4,77.71
3/25/2018 5:00,2018,3,25,5,74.03
3/25/2018 6:00,2018,3,25,6,67.36
3/25/2018 7:00,2018,3,25,7,55.83
3/25/2018 8:00,2018,3,25,8,55.28
3/25/2018 9:00,2018,3,25,9,51.61
3/25/2018 10:00,2018,3,25,10,48.21
3/25/2018 11:00,2018,3,25,11,48.08
3/25/2018 12:00,2018,3,25,12,49.88
3/25/2018 13:00,2018,3,25,13,49.32
3/25/2018 14:00,2018,3,25,14,58.17
3/25/2018 15:00,2018,3,25,15,58.24
3/25/2018 16:00,2018,3,25,16,64.43
3/25/2018 17:00,2018,3,25,17,74.31
3/25/2018 18:00,2018,3,25,18,81.48
3/25/2018 19:00,2018,3,25,19,80.89
